,entities,start_tokens,end_tokens,start_chars,end_chars,text,pmid,lf_chemical_distsv,lf_disease_distsv,label,orig_index,olabel
41,methylprednisolone,9,10,67,85,"Hypotension, bradycardia, and asystole after high-dose intravenous methylprednisolone in a monitored patient.",10074612_0,0,-1,0,41,0
44,methylprednisolone,16,17,105,123,"We report a case of hypotension, bradycardia, and asystole after intravenous administration of high-dose methylprednisolone in a 73-year-old patient who underwent electrocardiographic (ECG) monitoring throughout the episode.",10074612_1,0,-1,0,44,0
59,methylprednisolone,16,17,100,118,This study reviews the current proposed mechanisms of sudden death after a high dose of intravenous methylprednisolone (IVMP).,10074612_6,0,-1,0,59,0
81,selegiline,32,33,180,190,OBJECTIVES: The United Kingdom Parkinson's Disease Research Group (UKPDRG) trial found an increased mortality in patients with Parkinson's disease (PD) randomized to receive 10 mg selegiline per day and L-dopa compared with those taking L-dopa alone.,10091617_1,0,-1,0,81,0
82,selegiline,7,8,37,47,"Recently, we found that therapy with selegiline and L-dopa was associated with selective systolic orthostatic hypotension which was abolished by withdrawal of selegiline.",10091617_2,0,-1,0,82,0
85,selegiline,23,24,159,169,"Recently, we found that therapy with selegiline and L-dopa was associated with selective systolic orthostatic hypotension which was abolished by withdrawal of selegiline.",10091617_2,0,-1,0,85,0
90,selegiline,29,30,174,184,The aims of this study were to confirm our previous findings in a separate cohort of patients and to determine the time course of the cardiovascular consequences of stopping selegiline in the expectation that this might shed light on the mechanisms by which the drug causes orthostatic hypotension.,10091617_4,0,-1,0,90,0
94,selegiline,17,18,116,126,METHODS: The cardiovascular responses to standing and head-up tilt were studied repeatedly in PD patients receiving selegiline and as the drug was withdrawn.,10091617_5,0,-1,0,94,0
101,selegiline,9,10,67,77,Orthostatic hypotension was ameliorated 4 days after withdrawal of selegiline and totally abolished 7 days after discontinuation of the drug.,10091617_8,0,-1,0,101,0
102,selegiline,1,2,9,19,Stopping selegiline also significantly reduced the supine systolic and diastolic blood pressures consistent with a previously undescribed supine pressor action.,10091617_9,0,-1,0,102,0
106,selegiline,9,10,58,68,CONCLUSION: This study confirms our previous finding that selegiline in combination with L-dopa is associated with selective orthostatic hypotension.,10091617_10,0,-1,0,106,0
135,acetylsalicylic acid,36,38,153,173,"In the in vivo study, the administration (50 mg/kg, i.p.) of TET and FAN in mice showed the inhibition of thrombosis by 55% and 35%, respectively, while acetylsalicylic acid (ASA, 50 mg/kg, i.p.), a positive control, showed only 30% inhibition.",10193204_3,0,-1,0,135,0
179,lignocaine,10,11,66,76,Cauda equina syndrome after spinal anaesthesia with hyperbaric 5% lignocaine: a review of six cases of cauda equina syndrome reported to the Swedish Pharmaceutical Insurance 1993-1997.Six cases of cauda equina syndrome with varying severity were reported to the Swedish Pharmaceutical Insurance during the period 1993-1997.,10225068_0,0,-1,0,179,0
187,lignocaine,10,11,64,74,All were associated with spinal anaesthesia using hyperbaric 5% lignocaine.,10225068_1,0,-1,0,187,0
192,lignocaine,6,7,26,36,The dose of hyperbaric 5% lignocaine administered ranged from 60 to 120 mg.,10225068_3,0,-1,0,192,0
195,lignocaine,15,16,84,94,Three of the cases were most likely caused by direct neurotoxicity of hyperbaric 5% lignocaine.,10225068_4,0,-1,0,195,0
200,lignocaine,4,5,29,39,We recommend that hyperbaric lignocaine should be administered in concentrations not greater than 2% and at a total dose preferably not exceeding 60 mg.,10225068_7,0,-1,0,200,0
202,sirolimus,5,6,46,55,Systemic toxicity following administration of sirolimus (formerly rapamycin) for psoriasis: association of capillary leak syndrome with apoptosis of lesional lymphocytes.,10328196_0,0,-1,0,202,0
203,rapamycin,8,9,66,75,Systemic toxicity following administration of sirolimus (formerly rapamycin) for psoriasis: association of capillary leak syndrome with apoptosis of lesional lymphocytes.,10328196_0,0,-1,0,203,0
206,Sirolimus,2,3,12,21,BACKGROUND: Sirolimus (formerly rapamycin) is an immunosuppressive agent that interferes with T-cell activation.,10328196_1,0,-1,0,206,0
207,rapamycin,5,6,32,41,BACKGROUND: Sirolimus (formerly rapamycin) is an immunosuppressive agent that interferes with T-cell activation.,10328196_1,0,-1,0,207,0
211,sirolimus,14,15,101,110,After 2 individuals with psoriasis developed a capillary leak syndrome following treatment with oral sirolimus lesional skin cells and activated peripheral blood cells were analyzed for induction of apoptosis.,10328196_2,0,-1,0,211,0
221,sirolimus,28,29,194,203,"Activated peripheral blood T cells from patients with psoriasis tended to exhibit greater spontaneous or dexamethasone-induced apoptosis than did normal T cells, particularly in the presence of sirolimus.",10328196_4,0,-1,0,221,0
223,sirolimus,6,7,39,48,"CONCLUSIONS: Severe adverse effects of sirolimus include fever, anemia, and capillary leak syndrome.",10328196_5,0,-1,0,223,0
359,propofol,4,5,28,36,The haemodynamic effects of propofol in combination with ephedrine in elderly patients (ASA groups 3 and 4).The marked vasodilator and negative inotropic effects of propofol are disadvantages in frail elderly patients.,10520387_0,0,-1,0,359,0
363,propofol,25,26,165,173,The haemodynamic effects of propofol in combination with ephedrine in elderly patients (ASA groups 3 and 4).The marked vasodilator and negative inotropic effects of propofol are disadvantages in frail elderly patients.,10520387_0,0,-1,0,363,0
364,propofol,13,14,82,90,We investigated the safety and efficacy of adding different doses of ephedrine to propofol in order to obtund the hypotensive response.,10520387_1,0,-1,0,364,0
366,propofol,17,18,77,85,"The haemodynamic effects of adding 15, 20 or 25 mg of ephedrine to 200 mg of propofol were compared to control in 40 ASA 3/4 patients over 60 years presenting for genito-urinary surgery.",10520387_2,0,-1,0,366,0
369,propofol,5,6,29,37,The addition of ephedrine to propofol appears to be an effective method of obtunding the hypotensive response to propofol at all doses used in this study.,10520387_3,0,-1,0,369,0
370,propofol,18,19,113,121,The addition of ephedrine to propofol appears to be an effective method of obtunding the hypotensive response to propofol at all doses used in this study.,10520387_3,0,-1,0,370,0
372,propofol,13,14,85,93,"However, marked tachycardia associated with the use of ephedrine in combination with propofol occurred in the majority of patients, occasionally reaching high levels in individual patients.",10520387_4,0,-1,0,372,0
384,lead acetate,12,14,79,91,"Male Sprague-Dawley rats were randomly assigned to a lead-treated group (given lead acetate, 100 ppm, in drinking water and regular rat chow), a group given lead and vitamin E-fortified chow, or a normal control group given either regular food and water or vitamin E-fortified food for 12 weeks.",10523326_3,0,-1,0,384,0
390,malondialdehyde,9,10,51,66,"Tail blood pressure, urinary NOx excretion, plasma malondialdehyde (MDA), and endothelial and inducible NOS (eNOS and iNOS) isotypes in the aorta and kidney were measured.",10523326_4,0,-1,0,390,0
434,Gemcitabine,0,1,0,11,Gemcitabine plus vinorelbine in nonsmall cell lung carcinoma patients age 70 years or older or patients who cannot receive cisplatin.,10526274_0,0,-1,0,434,0
435,vinorelbine,2,3,17,28,Gemcitabine plus vinorelbine in nonsmall cell lung carcinoma patients age 70 years or older or patients who cannot receive cisplatin.,10526274_0,0,-1,0,435,0
437,cisplatin,20,21,123,132,Gemcitabine plus vinorelbine in nonsmall cell lung carcinoma patients age 70 years or older or patients who cannot receive cisplatin.,10526274_0,0,-1,0,437,0
441,vinorelbine,8,9,55,66,"Recent reports indicate that single agent therapy with vinorelbine (VNB) or gemcitabine (GEM) may obtain a response rate of 20-30% in elderly patients, with acceptable toxicity and improvement in symptoms and quality of life.",10526274_3,0,-1,0,441,0
443,gemcitabine,13,14,76,87,"Recent reports indicate that single agent therapy with vinorelbine (VNB) or gemcitabine (GEM) may obtain a response rate of 20-30% in elderly patients, with acceptable toxicity and improvement in symptoms and quality of life.",10526274_3,0,-1,0,443,0
448,cisplatin,28,29,170,179,In the current study the efficacy and toxicity of the combination of GEM and VNB in elderly patients with advanced NSCLC or those with some contraindication to receiving cisplatin were assessed.,10526274_4,0,-1,0,448,0
450,cisplatin,33,34,171,180,"METHODS: Forty-nine patients with advanced NSCLC were included, 38 of whom were age >/= 70 years and 11 were age < 70 years but who had some contraindication to receiving cisplatin.",10526274_5,0,-1,0,450,0
495,creatinine,10,11,56,66,Decreased renal function was defined as a rise in serum creatinine >/=0.5 mg/dL (44 micromol/L) from baseline.,10539815_5,0,-1,0,495,0
499,creatinine,21,22,146,156,"We used time-to-event analysis to identify potential predictors of decrease in renal function including age, baseline ejection fraction, baseline creatinine, low systolic blood pressure (<100 mm Hg), history of hypertension, diabetes, and use of antiplatelet, diuretic, and beta-blocker therapy.",10539815_6,0,-1,0,499,0
542,olanzapine,4,5,35,45,Hypomania-like syndrome induced by olanzapine.,10565806_0,0,-1,0,542,0
546,olanzapine,26,27,159,169,We report a female patient with a diagnosis of a not otherwise specified psychotic disorder (DSM-IV) who developed hypomania shortly after the introduction of olanzapine treatment.,10565806_1,0,-1,0,546,0
766,bromocriptine,5,6,29,42,"In control rats, intravenous bromocriptine (150 microg/kg) induced significant hypotension and tachycardia.",10721819_4,0,-1,0,766,0
784,bromocriptine,13,14,72,85,"They suggest that, in normal conscious rats, the central tachycardia of bromocriptine appears to predominate and to mask the bradycardia of this agonist at peripheral dopamine D2 receptors.",10721819_10,0,-1,0,784,0
813,oral contraceptives,4,6,23,42,Recurrent use of newer oral contraceptives and the risk of venous thromboembolism.,10739826_0,0,-1,0,813,0
818,oral contraceptives,16,18,105,124,"The epidemiological studies that assessed the risk of venous thromboembolism (VTE) associated with newer oral contraceptives (OC) did not distinguish between patterns of OC use, namely first-time users, repeaters and switchers.",10739826_1,0,-1,0,818,0
861,cyclosporine,8,9,65,77,Treatment of tacrolimus-related adverse effects by conversion to cyclosporine in liver transplant recipients.,10743694_0,0,-1,0,861,0
868,tacrolimus,6,7,37,47,"Of 388 liver recipients who received tacrolimus as primary immunosuppression, 70 required conversion to CyA. We recorded indication for conversion, whether conversion was early or late after transplantation, tacrolimus dose and trough blood level at conversion, and incidence of rejection after conversion.",10743694_3,0,-1,0,868,0
870,tacrolimus,31,32,208,218,"Of 388 liver recipients who received tacrolimus as primary immunosuppression, 70 required conversion to CyA. We recorded indication for conversion, whether conversion was early or late after transplantation, tacrolimus dose and trough blood level at conversion, and incidence of rejection after conversion.",10743694_3,0,-1,0,870,0
936,nimodipine,3,4,22,32,Effect of intravenous nimodipine on blood pressure and outcome after acute stroke.,10835440_0,0,-1,0,936,0
938,Nimodipine,6,7,40,50,BACKGROUND AND PURPOSE: The Intravenous Nimodipine West European Stroke Trial (INWEST) found a correlation between nimodipine-induced reduction in blood pressure (BP) and an unfavorable outcome in acute stroke.,10835440_1,0,-1,0,938,0
948,nimodipine,30,31,156,166,"METHODS: Patients with a clinical diagnosis of ischemic stroke (within 24 hours) were consecutively allocated to receive placebo (n=100), 1 mg/h (low-dose) nimodipine (n=101), or 2 mg/h (high-dose) nimodipine (n=94).",10835440_3,0,-1,0,948,0
950,nimodipine,41,42,198,208,"METHODS: Patients with a clinical diagnosis of ischemic stroke (within 24 hours) were consecutively allocated to receive placebo (n=100), 1 mg/h (low-dose) nimodipine (n=101), or 2 mg/h (high-dose) nimodipine (n=94).",10835440_3,0,-1,0,950,0
954,Nimodipine,0,1,0,10,Nimodipine treatment resulted in a statistically significant reduction in systolic BP (SBP) and diastolic BP (DBP) from baseline compared with placebo during the first few days.,10835440_6,0,-1,0,954,0
977,nimodipine,20,21,134,144,"CONCLUSIONS: DBP, but not SBP, reduction was associated with neurological worsening after the intravenous administration of high-dose nimodipine after acute stroke.",10835440_10,0,-1,0,977,0
979,nimodipine,2,3,13,23,"For low-dose nimodipine, the results were not conclusive.",10835440_11,0,-1,0,979,0
981,nimodipine,11,12,70,80,These results do not confirm or exclude a neuroprotective property of nimodipine.,10835440_12,0,-1,0,981,0
1118,Cyclosporine,0,1,0,12,Cyclosporine and tacrolimus-associated thrombotic microangiopathy.,11007689_0,0,-1,0,1118,0
1123,cyclosporine,13,14,79,91,The development of thrombotic microangiopathy (TMA) associated with the use of cyclosporine has been well documented.,11007689_1,0,-1,0,1123,0
1124,cyclosporine,7,8,57,69,"Treatments have included discontinuation or reduction of cyclosporine dose with or without concurrent plasma exchange, plasma infusion, anticoagulation, and intravenous immunoglobulin G infusion.",11007689_2,0,-1,0,1124,0
1132,tacrolimus,8,9,42,52,The last decade has seen the emergence of tacrolimus as a potent immunosuppressive agent with mechanisms of action virtually identical to those of cyclosporine.,11007689_4,0,-1,0,1132,0
1134,cyclosporine,23,24,147,159,The last decade has seen the emergence of tacrolimus as a potent immunosuppressive agent with mechanisms of action virtually identical to those of cyclosporine.,11007689_4,0,-1,0,1134,0
1135,tacrolimus,6,7,26,36,"As a result, switching to tacrolimus has been reported to be a viable therapeutic option in the setting of cyclosporine-induced TMA.",11007689_5,0,-1,0,1135,0
1137,tacrolimus,6,7,40,50,"With the more widespread application of tacrolimus in organ transplantation, tacrolimus-associated TMA has also been recognized.",11007689_6,0,-1,0,1137,0
1141,cyclosporine,16,17,105,117,"However, literature regarding the incidence of the recurrence of TMA in patients exposed sequentially to cyclosporine and tacrolimus is limited.",11007689_7,0,-1,0,1141,0
1142,tacrolimus,18,19,122,132,"However, literature regarding the incidence of the recurrence of TMA in patients exposed sequentially to cyclosporine and tacrolimus is limited.",11007689_7,0,-1,0,1142,0
1144,cyclosporine,21,22,137,149,We report a case of a living donor renal transplant recipient who developed cyclosporine-induced TMA that responded to the withdrawal of cyclosporine in conjunction with plasmapheresis and fresh frozen plasma replacement therapy.,11007689_8,0,-1,0,1144,0
1146,tacrolimus,2,3,16,26,Introduction of tacrolimus as an alternative immunosuppressive agent resulted in the recurrence of TMA and the subsequent loss of the renal allograft.,11007689_9,0,-1,0,1146,0
1150,cyclosporine,5,6,31,43,Patients who are switched from cyclosporine to tacrolimus or vice versa should be closely monitored for the signs and symptoms of recurrent TMA.,11007689_10,0,-1,0,1150,0
1151,tacrolimus,7,8,47,57,Patients who are switched from cyclosporine to tacrolimus or vice versa should be closely monitored for the signs and symptoms of recurrent TMA.,11007689_10,0,-1,0,1151,0
1267,methylprednisolone,1,2,10,28,High-dose methylprednisolone may do more harm for spinal cord injury.,11058428_0,0,-1,0,1267,0
1278,methylprednisolone,17,18,110,128,"In the NASCIS, there was no mention regarding the possibility of acute corticosteroid myopathy that high-dose methylprednisolone may cause.",11058428_2,0,-1,0,1278,0
1279,methylprednisolone,3,4,14,32,The dosage of methylprednisolone recommended by the NASCIS 3 is the highest dose of steroids ever being used during a 2-day period for any clinical condition.,11058428_3,0,-1,0,1279,0
1286,methylprednisolone,34,35,211,229,"Further, steroid myopathy recovers naturally and the neurological improvement shown in the NASCIS may be just a recording of this natural motor recovery from the steroid myopathy, instead of any protection that methylprednisolone offers to the spinal cord injury.",11058428_5,0,-1,0,1286,0
1288,methylprednisolone,14,15,84,102,"To our knowledge, this is the first discussion considering the possibility that the methylprednisolone recommended by NASCIS may cause acute corticosteroid myopathy.",11058428_6,0,-1,0,1288,0
1294,cyclosporine,18,19,103,115,BACKGROUND: The aim of this study is to evaluate the effects of RAPA conversion in patients undergoing cyclosporine (CsA) or tacrolimus (Tac) toxicity.,11063349_1,0,-1,0,1294,0
1296,tacrolimus,23,24,125,135,BACKGROUND: The aim of this study is to evaluate the effects of RAPA conversion in patients undergoing cyclosporine (CsA) or tacrolimus (Tac) toxicity.,11063349_1,0,-1,0,1296,0
1299,rapamycin,11,12,72,81,METHODS: Twenty renal transplant recipients were switched to fixed dose rapamycin (RAPA) (5 mg/day) 0 to 204 months posttransplant.,11063349_2,0,-1,0,1299,0
1311,creatinine,18,19,113,123,RESULTS: In the 12 patients switched because of chronic nephrotoxicity there was a significant decrease in serum creatinine [233+/-34 to 210+/-56 micromol/liter (P<0.05) at 6 months].,11063349_6,0,-1,0,1311,0
1338,vigabatrin,8,9,45,55,Six of the patients were no longer receiving vigabatrin.,11077455_3,0,-1,0,1338,0
1361,vigabatrin,9,10,75,85,The field defects and some electrophysiological abnormalities persist when vigabatrin therapy is withdrawn.,11077455_12,0,-1,0,1361,0
1364,dobutamine,8,9,56,66,Myocardial ischemia due to coronary artery spasm during dobutamine stress echocardiography.,11078231_0,0,-1,0,1364,0
1366,Dobutamine,0,1,0,10,Dobutamine stress echocardiography (DSE) is a useful and safe provocation test for myocardial ischemia.,11078231_1,0,-1,0,1366,0
1375,dobutamine,19,20,107,117,The aim of the present study is to examine whether myocardial ischemia due to coronary spasm is induced by dobutamine.,11078231_3,0,-1,0,1375,0
1386,dobutamine,5,6,35,45,"DSE was performed with intravenous dobutamine infusion with an incremental doses of 5, 10, 20, 30, and 40 microg/kg/min every 5 minutes.",11078231_7,0,-1,0,1386,0
1393,dobutamine,4,5,29,39,These findings indicate that dobutamine can provoke coronary spasm in some patients with coronary spastic angina.,11078231_10,0,-1,0,1393,0
1401,dobutamine,10,11,58,68,"STUDY OBJECTIVE: To determine the effect of metoprolol on dobutamine stress testing with technetium-99m sestamibi single-photon emission computed tomography imaging and ST-segment monitoring, and to assess the impact of intravenous glucagon on metoprolol's effects.",11079278_1,0,-1,0,1401,0
1409,dobutamine,4,5,33,43,INTERVENTION: Patients underwent dobutamine stress tests per standard protocol.,11079278_5,0,-1,0,1409,0
1412,dobutamine,1,2,7,17,"Before dobutamine was begun, no therapy was given during the first visit, and patients were randomized on subsequent visits to receive metoprolol or metoprolol plus glucagon 1 mg.",11079278_6,0,-1,0,1412,0
1422,dobutamine,3,4,19,29,"CONCLUSION: During dobutamine stress testing, metoprolol attenuates or eliminates evidence of myocardial ischemia.",11079278_12,0,-1,0,1422,0
1456,Paclitaxel,0,1,0,10,"Paclitaxel, cisplatin, and gemcitabine combination chemotherapy within a multidisciplinary therapeutic approach in metastatic nonsmall cell lung carcinoma.",11135224_0,0,-1,0,1456,0
1457,cisplatin,2,3,12,21,"Paclitaxel, cisplatin, and gemcitabine combination chemotherapy within a multidisciplinary therapeutic approach in metastatic nonsmall cell lung carcinoma.",11135224_0,0,-1,0,1457,0
1458,gemcitabine,5,6,27,38,"Paclitaxel, cisplatin, and gemcitabine combination chemotherapy within a multidisciplinary therapeutic approach in metastatic nonsmall cell lung carcinoma.",11135224_0,0,-1,0,1458,0
1468,paclitaxel,20,21,104,114,"METHODS: The objective of this study was to determine the feasibility, response rate, and toxicity of a paclitaxel, cisplatin, and gemcitabine combination to treat metastatic NSCLC.",11135224_3,0,-1,0,1468,0
1469,cisplatin,22,23,116,125,"METHODS: The objective of this study was to determine the feasibility, response rate, and toxicity of a paclitaxel, cisplatin, and gemcitabine combination to treat metastatic NSCLC.",11135224_3,0,-1,0,1469,0
1470,gemcitabine,25,26,131,142,"METHODS: The objective of this study was to determine the feasibility, response rate, and toxicity of a paclitaxel, cisplatin, and gemcitabine combination to treat metastatic NSCLC.",11135224_3,0,-1,0,1470,0
1477,paclitaxel,26,27,175,185,"Thirty-five consecutive chemotherapy-naive patients with Stage IV NSCLC and an Eastern Cooperative Oncology Group performance status of 0-2 were treated with a combination of paclitaxel (135 mg/m(2) given intravenously in 3 hours) on Day 1, cisplatin (120 mg/m(2) given intravenously in 6 hours) on Day 1, and gemcitabine (800 mg/m(2) given intravenously in 30 minutes) on Days 1 and 8, every 4 weeks.",11135224_4,0,-1,0,1477,0
1479,cisplatin,41,42,241,250,"Thirty-five consecutive chemotherapy-naive patients with Stage IV NSCLC and an Eastern Cooperative Oncology Group performance status of 0-2 were treated with a combination of paclitaxel (135 mg/m(2) given intravenously in 3 hours) on Day 1, cisplatin (120 mg/m(2) given intravenously in 6 hours) on Day 1, and gemcitabine (800 mg/m(2) given intravenously in 30 minutes) on Days 1 and 8, every 4 weeks.",11135224_4,0,-1,0,1479,0
1481,gemcitabine,57,58,310,321,"Thirty-five consecutive chemotherapy-naive patients with Stage IV NSCLC and an Eastern Cooperative Oncology Group performance status of 0-2 were treated with a combination of paclitaxel (135 mg/m(2) given intravenously in 3 hours) on Day 1, cisplatin (120 mg/m(2) given intravenously in 6 hours) on Day 1, and gemcitabine (800 mg/m(2) given intravenously in 30 minutes) on Days 1 and 8, every 4 weeks.",11135224_4,0,-1,0,1481,0
1491,paclitaxel,15,16,76,86,"After 154 courses of therapy, the median dose intensity was 131 mg/m(2) for paclitaxel (97.3%), 117 mg/m(2) for cisplatin (97.3%), and 1378 mg/m(2) for gemcitabine (86.2%).",11135224_9,0,-1,0,1491,0
1492,cisplatin,25,26,112,121,"After 154 courses of therapy, the median dose intensity was 131 mg/m(2) for paclitaxel (97.3%), 117 mg/m(2) for cisplatin (97.3%), and 1378 mg/m(2) for gemcitabine (86.2%).",11135224_9,0,-1,0,1492,0
1493,gemcitabine,36,37,152,163,"After 154 courses of therapy, the median dose intensity was 131 mg/m(2) for paclitaxel (97.3%), 117 mg/m(2) for cisplatin (97.3%), and 1378 mg/m(2) for gemcitabine (86.2%).",11135224_9,0,-1,0,1493,0
1498,cisplatin,7,8,44,53,"CONCLUSIONS: The combination of paclitaxel, cisplatin, and gemcitabine is well tolerated and shows high activity in metastatic NSCLC.",11135224_14,0,-1,0,1498,0
1499,gemcitabine,10,11,59,70,"CONCLUSIONS: The combination of paclitaxel, cisplatin, and gemcitabine is well tolerated and shows high activity in metastatic NSCLC.",11135224_14,0,-1,0,1499,0
1508,venlafaxine,10,11,72,83,This concerns 2 male patients who experienced incontinence while taking venlafaxine.,11147747_3,0,-1,0,1508,0
1511,venlafaxine,35,36,224,235,"In the present paper the authors describe 2 female patients who developed incontinence secondary to the selective serotonin reuptake inhibitors paroxetine and sertraline, as well as a third who developed this side effect on venlafaxine.",11147747_4,0,-1,0,1511,0
1534,benzoylecgonine,9,10,61,76,Plasma was tested for amphetamine and the cocaine metabolite benzoylecgonine using enzyme-mediated immunoassay methodology.,11185967_3,0,-1,0,1534,0
1536,benzoylecgonine,3,4,20,35,Plasma samples with benzoylecgonine greater than 150 ng/mL or an amphetamine greater than 500 ng/mL were defined as positive.,11185967_4,0,-1,0,1536,0
1543,benzoylecgonine,23,24,106,121,"RESULTS: Fourteen of 248 (5.6%, 95% CI 2.7%-8.5%) plasma samples were positive by immunoassay testing for benzoylecgonine and no samples (0%, 95% CI 0-1.2%) were positive for amphetamine.",11185967_6,0,-1,0,1543,0
1555,zonisamide,4,5,28,38,"After substituting VPA with zonisamide, the serum sodium level returned to normal.",11195262_3,0,-1,0,1555,0
1596,picrotoxin,21,22,124,134,"Results presented here show that the differential sensitivities of BS and BR lines to beta-CCM can be extended to diazepam, picrotoxin, and pentylenetetrazol, suggesting a genetic selection of a general sensitivity and resistance to several ligands of the GABA(A) receptor.",11206082_5,0,-1,0,1596,0
1604,adriamycin,25,26,146,156,We have studied the role of NO and its association with apoptosis in an experimental model of nephrotic syndrome induced by a single injection of adriamycin (ADR).,11208990_2,0,-1,0,1604,0
1645,ketamine-,13,14,73,82,Melatonin 0.5 and 5 mg/kg influenced the duration but not the latency of ketamine- or diazepam-induced narcosis.,11226639_6,0,-1,0,1645,0
1651,cyclophosphamide,10,11,97,113,"Reduced cardiotoxicity and preserved antitumor efficacy of liposome-encapsulated doxorubicin and cyclophosphamide compared with conventional doxorubicin and cyclophosphamide in a randomized, multicenter trial of metastatic breast cancer.",11230490_0,0,-1,0,1651,0
