,entities,start_tokens,end_tokens,start_chars,end_chars,text,pmid,lf_chemical_distsv,lf_disease_distsv,label,orig_index,olabel
10908,sulfasalazine,6,7,44,57,The likely frequency of hepatotoxicity with sulfasalazine was estimated by making a series of conservative assumptions.,18405372_6,0,-1,0,10908,0
10919,sulfasalazine,7,8,52,65,The likely frequency of serious hepatotoxicity with sulfasalazine was estimated at 0.4% of treated patients.,18405372_14,0,-1,0,10919,0
11007,aspartate,18,19,149,158,In vivo microdialysis demonstrated that an intraperitoneal administration of pilocarpine induced a pronounced increment of hippocampal glutamate and aspartate whereas no significant change was observed on the level of glycine and GABA.,18439803_3,0,-1,0,11007,0
11012,aspartate,26,27,156,165,Pretreatment with either VPU (50 and 100 mg/kg) or VPA (300 and 600 mg/kg) completely abolished pilocarpine-evoked increases in extracellular glutamate and aspartate.,18439803_4,0,-1,0,11012,0
11015,aspartate,26,27,153,162,"In addition, a statistically significant reduction was also observed on the level of GABA and glycine but less than a drastic reduction of glutamate and aspartate level.",18439803_5,0,-1,0,11015,0
11018,amino acid,23,25,149,159,Based on the finding that VPU and VPA could protect the animals against pilocarpine-induced seizure it is suggested that the reduction of inhibitory amino acid neurotransmitters was comparatively minor and offset by a pronounced reduction of glutamate and aspartate.,18439803_6,0,-1,0,11018,0
11019,aspartate,38,39,256,265,Based on the finding that VPU and VPA could protect the animals against pilocarpine-induced seizure it is suggested that the reduction of inhibitory amino acid neurotransmitters was comparatively minor and offset by a pronounced reduction of glutamate and aspartate.,18439803_6,0,-1,0,11019,0
11023,aspartate,17,18,114,123,"Therefore, like VPA, the finding that VPU could drastically reduce pilocarpine-induced increases in glutamate and aspartate should account, at least partly, for its anticonvulsant activity observed in pilocarpine-induced seizure in experimental animals.",18439803_7,0,-1,0,11023,0
11100,cyclophosphamide,15,16,114,130,Exaggerated expression of inflammatory mediators in vasoactive intestinal polypeptide knockout (VIP-/-) mice with cyclophosphamide (CYP)-induced cystitis.,18483878_0,0,-1,0,11100,0
11107,cyclophosphamide,14,15,106,122,VIP(-/-) mice exhibit altered bladder function and neurochemical properties in micturition pathways after cyclophosphamide (CYP)-induced cystitis.,18483878_2,0,-1,0,11107,0
11171,terbutaline,6,7,27,38,Six EMs received 0.5 mg of terbutaline s.c. on two different occasions: 1) 1 hr after administration of a placebo and 2) 1 hr after 150 mg of metoprolol p.o.,1848636_6,0,-1,0,11171,0
11172,terbutaline,14,15,74,85,"Five PMs were studied according to the same protocol, except for a higher terbutaline dose (0.75 mg) on day 2.",1848636_7,0,-1,0,11172,0
11174,terbutaline,9,10,52,63,"Blood samples for the analysis of plasma potassium, terbutaline, metoprolol (racemic, R- and S-isomer), and alpha-hydroxymetoprolol concentrations were taken at regular time intervals, during 8 hr after metoprolol.",1848636_8,0,-1,0,11174,0
11180,terbutaline,6,7,33,44,"In PMs, metoprolol increased the terbutaline area under the plasma concentration vs. time curve (+67%).",1848636_9,0,-1,0,11180,0
11189,everolimus,8,9,72,82,Recovery of tacrolimus-associated brachial neuritis after conversion to everolimus in a pediatric renal transplant recipient--case report and review of the literature.,18503483_0,0,-1,0,11189,0
11205,methylprednisolone,17,18,105,123,"Symptoms persisted for three months despite TAC dose reduction, administration of IVIG and four doses of methylprednisolone pulse therapy.",18503483_6,0,-1,0,11205,0
11207,everolimus,16,17,122,132,Improvement and eventually full recovery only occurred after TAC was completely discontinued and successfully replaced by everolimus.,18503483_7,0,-1,0,11207,0
11275,sevoflurane,12,13,78,89,"Omitting fentanyl reduces nausea and vomiting, without increasing pain, after sevoflurane for day surgery.",18544179_0,0,-1,0,11275,0
11277,sevoflurane,13,14,94,105,"BACKGROUND AND OBJECTIVE: Despite advantages of induction and maintenance of anaesthesia with sevoflurane, postoperative nausea and vomiting occurs frequently.",18544179_1,0,-1,0,11277,0
11281,sevoflurane,23,24,139,150,METHODS: This double-blind study examined the incidence and severity of postoperative nausea and vomiting and pain in the first 24 h after sevoflurane anaesthesia in 216 adult day surgery patients.,18544179_3,0,-1,0,11281,0
11296,sevoflurane,33,34,234,245,"CONCLUSION: As fentanyl exacerbated postoperative nausea and vomiting without an improvement in postoperative pain and also had adverse cardiorespiratory effects, it appears to be an unnecessary and possibly detrimental supplement to sevoflurane in day surgery.",18544179_11,0,-1,0,11296,0
11301,pergolide,11,12,73,82,Valvular heart disease in patients with Parkinson's disease treated with pergolide.,18560792_0,0,-1,0,11301,0
11306,pergolide,17,18,103,112,Valvular heart abnormalities have been reported in patients with Parkinson's disease (PD) treated with pergolide.,18560792_2,0,-1,0,11306,0
11313,pergolide,11,12,57,66,METHODS: All PD patients in the Amiens area treated with pergolide were invited to attend a cardiologic assessment including transthoracic echocardiography.,18560792_5,0,-1,0,11313,0
11317,pergolide,13,14,75,84,A second echocardiography was performed (median interval: 13 months) after pergolide withdrawal (n=10 patients).,18560792_7,0,-1,0,11317,0
11325,pergolide,28,29,150,159,"The number of affected valves (n=2.4+/-0.7) and the sum of regurgitation grades (n=2.8+/-1.09) were higher (p=0.008 and p=0.006, respectively) in the pergolide group.",18560792_10,0,-1,0,11325,0
11326,pergolide,7,8,50,59,Severity of regurgitation was not correlated with pergolide cumulative dose.,18560792_11,0,-1,0,11326,0
11328,pergolide,12,13,75,84,"A restrictive pattern of valvular regurgitation, suggestive of the role of pergolide, was observed in 12/30 (40%) patients including two with heart failure.",18560792_12,0,-1,0,11328,0
11330,Pergolide,0,1,0,9,"Pergolide was discontinued in 10 patients with valvular heart disease, resulting in a lower regurgitation grade (p=0.01) at the second transthoracic echocardiography and the two patients with heart failure returned to nearly normal clinical examination.",18560792_13,0,-1,0,11330,0
11337,pergolide,15,16,102,111,This study supports the high frequency of restrictive valve regurgitation in PD patients treated with pergolide and reveals that a significant improvement is usual when the treatment is converted to non-ergot dopamine agonists.,18560792_14,0,-1,0,11337,0
11372,adriamycin,9,10,63,73,BACKGROUND: The mechanisms underlying heart failure induced by adriamycin are very complicated and still unclear.,18619688_1,0,-1,0,11372,0
11375,adriamycin,20,21,119,129,"The aim of this study was to investigate whether autophagy was involved in the progression of heart failure induced by adriamycin, so that we can develop a novel treatment strategy for heart failure.",18619688_2,0,-1,0,11375,0
11378,3-methyladenine,2,3,9,24,"METHODS: 3-methyladenine (3MA), a specific inhibitor on autophagy was used in a heart failure model of rats induced by adriamycin.",18619688_3,0,-1,0,11378,0
11381,adriamycin,23,24,119,129,"METHODS: 3-methyladenine (3MA), a specific inhibitor on autophagy was used in a heart failure model of rats induced by adriamycin.",18619688_3,0,-1,0,11381,0
11405,adriamycin,2,3,13,23,"Furthermore, adriamycin induced the formation of autophagic vacuoles, and 3MA strongly downregulated the expression of beclin 1 in adriamycin-induced failing heart and inhibited the formation of autophagic vacuoles.",18619688_9,0,-1,0,11405,0
11414,adriamycin,19,20,123,133,CONCLUSION: Autophagic cardiomyocyte death plays an important role in the pathogenesis of heart failure in rats induced by adriamycin.,18619688_10,0,-1,0,11414,0
11417,adriamycin,13,14,83,93,Mitochondrial injury may be involved in the progression of heart failure caused by adriamycin via the autophagy pathway.,18619688_11,0,-1,0,11417,0
11459,sirolimus,23,24,160,169,"Massive urinary protein excretion has been observed after conversion from calcineurin inhibitors to mammalian target of rapamycin (mToR) inhibitors, especially sirolimus, in renal transplant recipients with chronic allograft nephropathy.",18631865_1,0,-1,0,11459,0
11464,sirolimus,5,6,31,40,Whether proteinuria was due to sirolimus or only a consequence of calcineurin inhibitors withdrawal remained unsolved until high range proteinuria has been observed during sirolimus therapy in islet transplantation and in patients who received sirolimus de novo.,18631865_3,0,-1,0,11464,0
11467,sirolimus,24,25,172,181,Whether proteinuria was due to sirolimus or only a consequence of calcineurin inhibitors withdrawal remained unsolved until high range proteinuria has been observed during sirolimus therapy in islet transplantation and in patients who received sirolimus de novo.,18631865_3,0,-1,0,11467,0
11519,Adriamycin,6,7,36,46,"Often, chemotherapy by doxorubicin (Adriamycin) is limited due to life threatening cardiotoxicity in patients during and posttherapy.",18674790_1,0,-1,0,11519,0
11677,creatinine,4,5,25,35,"Urinary volume and serum creatinine levels recovered to the normal range, with urinary protein disappearing completely within 40 days.",18754075_4,0,-1,0,11677,0
11788,Alpha-lipoic acid,0,2,0,17,Alpha-lipoic acid prevents mitochondrial damage and neurotoxicity in experimental chemotherapy neuropathy.,18809400_0,0,-1,0,11788,0
11791,alpha-lipoic acid,4,6,26,43,"The study investigates if alpha-lipoic acid is neuroprotective against chemotherapy induced neurotoxicity, if mitochondrial damage plays a critical role in toxic neurodegenerative cascade, and if neuroprotective effects of alpha-lipoic acid depend on mitochondria protection.",18809400_1,0,-1,0,11791,0
11797,alpha-lipoic acid,30,32,223,240,"The study investigates if alpha-lipoic acid is neuroprotective against chemotherapy induced neurotoxicity, if mitochondrial damage plays a critical role in toxic neurodegenerative cascade, and if neuroprotective effects of alpha-lipoic acid depend on mitochondria protection.",18809400_1,0,-1,0,11797,0
11805,paclitaxel,32,33,191,201,"We used an in vitro model of chemotherapy induced peripheral neuropathy that closely mimic the in vivo condition by exposing primary cultures of dorsal root ganglion (DRG) sensory neurons to paclitaxel and cisplatin, two widely used and highly effective chemotherapeutic drugs.",18809400_2,0,-1,0,11805,0
11806,cisplatin,34,35,206,215,"We used an in vitro model of chemotherapy induced peripheral neuropathy that closely mimic the in vivo condition by exposing primary cultures of dorsal root ganglion (DRG) sensory neurons to paclitaxel and cisplatin, two widely used and highly effective chemotherapeutic drugs.",18809400_2,0,-1,0,11806,0
11808,alpha-lipoic acid,7,9,52,69,This approach allowed investigating the efficacy of alpha-lipoic acid in preventing axonal damage and apoptosis and the function and ultrastructural morphology of mitochondria after exposure to toxic agents and alpha-lipoic acid.,18809400_3,0,-1,0,11808,0
11813,alpha-lipoic acid,29,31,211,228,This approach allowed investigating the efficacy of alpha-lipoic acid in preventing axonal damage and apoptosis and the function and ultrastructural morphology of mitochondria after exposure to toxic agents and alpha-lipoic acid.,18809400_3,0,-1,0,11813,0
11814,cisplatin,5,6,34,43,Our results demonstrate that both cisplatin and paclitaxel cause early mitochondrial impairment with loss of membrane potential and induction of autophagic vacuoles in neurons.,18809400_4,0,-1,0,11814,0
11818,Alpha-lipoic acid,0,2,0,17,"Alpha-lipoic acid exerts neuroprotective effects against chemotherapy induced neurotoxicity in sensory neurons: it rescues the mitochondrial toxicity and induces the expression of frataxin, an essential mitochondrial protein with anti-oxidant and chaperone properties.",18809400_5,0,-1,0,11818,0
11827,paclitaxel,11,12,70,80,In conclusion mitochondrial toxicity is an early common event both in paclitaxel and cisplatin induced neurotoxicity.,18809400_6,0,-1,0,11827,0
11828,cisplatin,13,14,85,94,In conclusion mitochondrial toxicity is an early common event both in paclitaxel and cisplatin induced neurotoxicity.,18809400_6,0,-1,0,11828,0
11830,Alpha-lipoic acid,0,2,0,17,"Alpha-lipoic acid protects sensory neurons through its anti-oxidant and mitochondrial regulatory functions, possibly inducing the expression of frataxin.",18809400_7,0,-1,0,11830,0
11835,alpha-lipoic acid,4,6,28,45,These findings suggest that alpha-lipoic acid might reduce the risk of developing peripheral nerve toxicity in patients undergoing chemotherapy and encourage further confirmatory clinical trials.,18809400_8,0,-1,0,11835,0
11876,oral contraceptives,10,12,70,89,Etiologic factors in the pathogenesis of liver tumors associated with oral contraceptives.,188339_0,0,-1,0,11876,0
11914,Ifosfamide,0,1,0,10,Ifosfamide continuous infusion without mesna.,1899352_0,0,-1,0,11914,0
11915,mesna,4,5,39,44,Ifosfamide continuous infusion without mesna.,1899352_0,0,-1,0,11915,0
11917,ifosfamide,6,7,39,49,Twenty patients received 27 courses of ifosfamide administered as a 24-hour continuous infusion for 14 days without Mesna.,1899352_2,0,-1,0,11917,0
11918,Mesna,17,18,116,121,Twenty patients received 27 courses of ifosfamide administered as a 24-hour continuous infusion for 14 days without Mesna.,1899352_2,0,-1,0,11918,0
11920,ifosfamide,16,17,78,88,The goal of the study was to deliver a dose rate and total cumulative dose of ifosfamide that would be comparable to standard bolus or short-term infusions administered with Mesna.,1899352_3,0,-1,0,11920,0
11922,Mesna,29,30,174,179,The goal of the study was to deliver a dose rate and total cumulative dose of ifosfamide that would be comparable to standard bolus or short-term infusions administered with Mesna.,1899352_3,0,-1,0,11922,0
11933,Mesna,22,23,132,137,"The frequency and predictability of hematuria are not precise, and at least daily monitoring by urine Hematest is essential, adding Mesna to the infusate in patients with persistent hematuria.",1899352_10,0,-1,0,11933,0
11936,ifosfamide,5,6,37,47,The protracted infusion schedule for ifosfamide permits convenient outpatient administration without Mesna and reduces the drug cost of clinical usage of this agent by up to  890 per cycle.,1899352_11,0,-1,0,11936,0
11937,Mesna,11,12,101,106,The protracted infusion schedule for ifosfamide permits convenient outpatient administration without Mesna and reduces the drug cost of clinical usage of this agent by up to  890 per cycle.,1899352_11,0,-1,0,11937,0
11987,green tea,2,4,10,19,Effect of green tea and vitamin E combination in isoproterenol induced myocardial infarction in rats.,19058010_0,0,-1,0,11987,0
11991,green tea,11,13,67,76,"The present study was aimed to investigate the combined effects of green tea and vitamin E on heart weight, body weight, serum marker enzymes, lipid peroxidation, endogenous antioxidants and membrane bound ATPases in isoproterenol (ISO)-induced myocardial infarction in rats.",19058010_1,0,-1,0,11991,0
12009,green tea,2,4,18,27,"Administration of green tea (100 mg/kg/day, p.o.) and vitamin E (100 mg/kg/day, p.o.) together for 30 consecutive days and challenged with ISO on the day 29th and 30th, showed a significant (P<0.05) decrease in heart weight, serum marker enzymes, lipid peroxidation, Ca+2 ATPase and a significant increase in the body weight, endogenous antioxidants, Na+/K+ ATPase and Mg+2 ATPase when compared with ISO treated group and green tea or vitamin E alone treated groups.",19058010_3,0,-1,0,12009,0
12020,green tea,81,83,422,431,"Administration of green tea (100 mg/kg/day, p.o.) and vitamin E (100 mg/kg/day, p.o.) together for 30 consecutive days and challenged with ISO on the day 29th and 30th, showed a significant (P<0.05) decrease in heart weight, serum marker enzymes, lipid peroxidation, Ca+2 ATPase and a significant increase in the body weight, endogenous antioxidants, Na+/K+ ATPase and Mg+2 ATPase when compared with ISO treated group and green tea or vitamin E alone treated groups.",19058010_3,0,-1,0,12020,0
12023,green tea,8,10,61,70,These findings indicate the synergistic protective effect of green tea and vitamin E during ISO induced myocardial infarction in rats.,19058010_4,0,-1,0,12023,0
12037,bupropion,7,8,55,64,Effect of increasing intraperitoneal infusion rates on bupropion hydrochloride-induced seizures in mice.,19105845_0,0,-1,0,12037,0
12039,bupropion,10,11,70,79,"This is important, since different controlled release formulations of bupropion release the active drug at different rates.",19105845_2,0,-1,0,12039,0
12042,bupropion,13,14,85,94,"METHODS: We investigated the effect of varying the intraperitoneal infusion rates of bupropion HCl 120 mg/kg, a known convulsive dose 50 (CD50), on the incidence and severity of bupropion-induced convulsions in the Swiss albino mice.",19105845_3,0,-1,0,12042,0
12046,bupropion,22,23,104,113,"A total of 69 mice, approximately 7 weeks of age, and weighing 21.0 to 29.1 g were randomly assigned to bupropion HCl 120 mg/kg treatment by intraperitoneal (IP) administration in 7 groups (9 to 10 animals per group).",19105845_4,0,-1,0,12046,0
12052,bupropion,9,10,54,63,RESULTS: The results showed that IP administration of bupropion HCl 120 mg/kg by bolus injection induced convulsions in 6 out of 10 mice (60% of convulsing mice) in group 1.,19105845_7,0,-1,0,12052,0
12060,bupropion,26,27,145,154,Logistic regression analysis revealed that infusion time was significant (p = 0.0004; odds ratio = 0.974) and increasing the IP infusion time of bupropion HCl 120 mg/kg was associated with a 91% reduced odds of convulsions at infusion times of 15 to 90 min compared to bolus injection.,19105845_8,0,-1,0,12060,0
12065,bupropion,21,22,128,137,"CONCLUSION: In conclusion, the demonstration of an inverse relationship between infusion time of a fixed and convulsive dose of bupropion and the risk of convulsions in a prospective study is novel.",19105845_10,0,-1,0,12065,0
12068,everolimus,4,5,43,53,Graft-versus-host disease prophylaxis with everolimus and tacrolimus is associated with a high incidence of sinusoidal obstruction syndrome and microangiopathy: results of the EVTAC trial.,19135948_0,0,-1,0,12068,0
12069,tacrolimus,6,7,58,68,Graft-versus-host disease prophylaxis with everolimus and tacrolimus is associated with a high incidence of sinusoidal obstruction syndrome and microangiopathy: results of the EVTAC trial.,19135948_0,0,-1,0,12069,0
12080,Everolimus,0,1,0,10,"Everolimus, a derivative of sirolimus, seems to mediate antileukemia effects.",19135948_2,0,-1,0,12080,0
12081,sirolimus,5,6,28,37,"Everolimus, a derivative of sirolimus, seems to mediate antileukemia effects.",19135948_2,0,-1,0,12081,0
12083,everolimus,6,7,30,40,"We report on a combination of everolimus and tacrolimus in 24 patients (median age, 62 years) with either myelodysplastic syndrome (MDS; n = 17) or acute myeloid leukemia (AML; n = 7) undergoing intensive conditioning followed by HSCT from related (n = 4) or unrelated (n = 20) donors.",19135948_3,0,-1,0,12083,0
12084,tacrolimus,8,9,45,55,"We report on a combination of everolimus and tacrolimus in 24 patients (median age, 62 years) with either myelodysplastic syndrome (MDS; n = 17) or acute myeloid leukemia (AML; n = 7) undergoing intensive conditioning followed by HSCT from related (n = 4) or unrelated (n = 20) donors.",19135948_3,0,-1,0,12084,0
12140,paracetamol,20,21,142,153,Renal papillary necrosis (RPN) and a decreased urinary concentrating ability developed during continuous long-term treatment with aspirin and paracetamol in female Fischer 344 rats.,1919871_1,0,-1,0,12140,0
12160,sulphasalazine,10,11,117,131,Proteinase 3-antineutrophil cytoplasmic antibody-(PR3-ANCA) positive necrotizing glomerulonephritis after restarting sulphasalazine treatment.,19203554_0,0,-1,0,12160,0
12165,sulphasalazine,20,21,141,155,"A 59-year-old woman with ulcerative colitis developed red eyes, pleural effusion, eosinophilia and urinary abnormalities after restarting of sulphasalazine treatment.",19203554_1,0,-1,0,12165,0
12174,sulphasalazine,3,4,22,36,"Although cessation of sulphasalazine treatment resulted in improvements in fever, red eyes, chest pain, titer of C-reactive protein and volume of the pleural effusions, we initiated steroid therapy, because PR3-ANCA titer rose to 320 EU, eosinophil count increased to 1,100 cells/microl, and the pleural effusion remained.",19203554_5,0,-1,0,12174,0
12184,sulphasalazine,4,5,24,38,This case suggests that sulphasalazine can induce PR3-ANCA-positive necrotizing glomerulonephritis.,19203554_7,0,-1,0,12184,0
12289,cyclophosphamide,8,9,47,63,DSMM XI study: dose definition for intravenous cyclophosphamide in combination with bortezomib/dexamethasone for remission induction in patients with newly diagnosed myeloma.,19274460_0,0,-1,0,12289,0
12294,cyclophosphamide,11,12,67,83,A clinical trial was initiated to evaluate the recommended dose of cyclophosphamide in combination with bortezomib and dexamethasone as induction treatment before stem cell transplantation for younger patients with newly diagnosed multiple myeloma (MM).,19274460_1,0,-1,0,12294,0
12303,cyclophosphamide,38,39,187,203,"Thirty patients were treated with three 21-day cycles of bortezomib 1.3 mg/m(2) on days 1, 4, 8, and 11 plus dexamethasone 40 mg on the day of bortezomib injection and the day after plus cyclophosphamide at 900, 1,200, or 1,500 mg/m(2) on day 1.",19274460_2,0,-1,0,12303,0
12305,cyclophosphamide,5,6,30,46,The maximum tolerated dose of cyclophosphamide was defined as 900 mg/m(2).,19274460_3,0,-1,0,12305,0
12312,cyclophosphamide,8,9,56,72,The results suggest that bortezomib in combination with cyclophosphamide at 900 mg/m(2) and dexamethasone is an effective induction treatment for patients with newly diagnosed MM that warrants further investigation.,19274460_8,0,-1,0,12312,0
12384,Bradykinin,0,1,0,10,Bradykinin receptors antagonists and nitric oxide synthase inhibitors in vincristine and streptozotocin induced hyperalgesia in chemotherapy and diabetic neuropathy rat model.,19300402_0,0,-1,0,12384,0
12386,streptozotocin,11,12,89,103,Bradykinin receptors antagonists and nitric oxide synthase inhibitors in vincristine and streptozotocin induced hyperalgesia in chemotherapy and diabetic neuropathy rat model.,19300402_0,0,-1,0,12386,0
12399,bradykinin,66,67,373,383,"PURPOSE: The influence of an irreversible inhibitor of constitutive NO synthase (L-NOArg; 1.0 mg/kg ip), a relatively selective inhibitor of inducible NO synthase (L-NIL; 1.0 mg/kg ip) and a relatively specific inhibitor of neuronal NO synthase (7-NI; 0.1 mg/kg ip), on antihyperalgesic action of selective antagonists of B2 and B1 receptors: D-Arg-[Hyp3,Thi5,D-Tic7,Oic8] bradykinin (HOE 140; 70 nmol/kg ip) or des Arg10 HOE 140 (70 nmol/kg ip) respectively, in model of diabetic (streptozotocin-induced) and toxic (vincristine-induced) neuropathy was investigated.",19300402_1,0,-1,0,12399,0
12404,bradykinin,11,12,62,72,RESULTS: The results of this paper confirm that inhibition of bradykinin receptors and inducible NO synthase but not neuronal NO synthase activity reduces diabetic hyperalgesia.,19300402_3,0,-1,0,12404,0
12416,bradykinin,19,20,109,119,It was also shown that both products of inducible NO synthase and neuronal NO synthase activation as well as bradykinin are involved in hyperalgesia produced by vincristine.,19300402_5,0,-1,0,12416,0
12429,bradykinin,12,13,105,115,"In streptozotocin-induced hyperalgesia, inducible NO synthase participates in pronociceptive activity of bradykinin, whereas in vincristine-induced hyperalgesia bradykinin seemed to activate neuronal NO synthase pathway.",19300402_8,0,-1,0,12429,0
12432,bradykinin,8,9,56,66,"Therefore, concomitant administration of small doses of bradykinin receptor antagonists and NO synthase inhibitors can be effective in alleviation of neuropathic pain, even in hospital care.",19300402_9,0,-1,0,12432,0
12518,sirolimus,7,8,67,76,Clinically significant proteinuria following the administration of sirolimus to renal transplant recipients.,19356053_0,0,-1,0,12518,0
12520,Sirolimus,2,3,12,21,"BACKGROUND: Sirolimus is the latest immunosuppressive agent used to prevent rejection, and may have less nephrotoxicity than calcineurin inhibitor (CNI)-based regimens.",19356053_1,0,-1,0,12520,0
12526,sirolimus,16,17,105,114,To date there has been little documentation of clinically significant proteinuria linked with the use of sirolimus.,19356053_2,0,-1,0,12526,0
12528,sirolimus,12,13,76,85,"In each patient, the close temporal association between the commencement of sirolimus therapy and proteinuria implicated sirolimus as the most likely etiology of the proteinuria.",19356053_4,0,-1,0,12528,0
12529,sirolimus,17,18,121,130,"In each patient, the close temporal association between the commencement of sirolimus therapy and proteinuria implicated sirolimus as the most likely etiology of the proteinuria.",19356053_4,0,-1,0,12529,0
12532,sirolimus,26,27,166,175,METHODS: We analyzed the clinical and laboratory information available for all 119 patients transplanted at the Washington Hospital Center between 1999-2003 for whom sirolimus was a component of their immunosuppressant regimen.,19356053_5,0,-1,0,12532,0
12540,sirolimus,10,11,69,78,"Laboratory results were compared between prior, during and following sirolimus use.",19356053_7,0,-1,0,12540,0
