,entities,start_tokens,end_tokens,start_chars,end_chars,text,pmid,label,orig_index,olabel
2216,ovarian cancer,21,23,115,129,"We have examined 22 families with at least one case of male breast cancer for linkage to the hereditary breast and ovarian cancer locus, BRCA1, on chromosome 17q.",8075631_2,0,2216,0
2217,breast cancer,18,20,96,109,Our results indicate that there is a gene (s) other than BRCA1 which predisposes to early-onset breast cancer in women and which confers a higher risk of male breast cancer.,8075631_4,0,2217,0
2218,breast cancer,30,32,159,172,Our results indicate that there is a gene (s) other than BRCA1 which predisposes to early-onset breast cancer in women and which confers a higher risk of male breast cancer.,8075631_4,0,2218,0
2219,breast cancer,9,11,66,79,Identification of additional pedigrees that include cases of male breast cancer may therefore facilitate the mapping and isolation of this gene.,8075631_5,0,2219,0
2220,tumors,9,10,42,48,"The EWS gene, involved in Ewing family of tumors, malignant melanoma of soft parts and desmoplastic small round cell tumors, codes for an RNA binding protein with novel regulatory domains.",8084618_0,0,2220,0
2222,tumors,21,22,117,123,"The EWS gene, involved in Ewing family of tumors, malignant melanoma of soft parts and desmoplastic small round cell tumors, codes for an RNA binding protein with novel regulatory domains.",8084618_0,0,2222,0
2227,tumors,43,44,248,254,"
The EWS gene, which maps to band q12 of human chromosome 22, is involved in a wide variety of human solid tumors including Ewing sarcoma, related primitive neuroectodermal tumors, malignant melanoma of soft parts and desmoplastic small round cell tumors.",8084618_1,0,2227,0
2228,tumors,2,3,9,15,"In these tumors, the EWS is fused to genes encoding transcriptional activators/repressors, like Fli-1 or erg or ATF 1 or wt1.",8084618_2,0,2228,0
2271,cancer,29,30,155,161,"Eighteen patients had no family history of the disease; of these 11 were classified as having a severe phenotype, based on an early age at presentation or cancer development.",8162051_5,0,2271,0
2280,cancers,14,15,92,99,Frequent detection of codon 877 mutation in the androgen receptor gene in advanced prostate cancers.,8187068_0,0,2280,0
2281,prostate cancer,11,13,94,109,"
Prostatic tissue specimens derived from transurethral resections of patients with metastatic prostate cancer were analyzed for genetic alterations in the hormone-binding domain of the androgen receptor (AR) gene.",8187068_1,0,2281,0
2282,prostate cancer,11,13,67,82,"This same AR mutation has been reported previously in a metastatic prostate cancer cell line, LNCaP, where this mutation confers upon the AR an altered ligand-binding specificity which is stimulated by estrogens, progestagens, and antiandrogens.",8187068_3,0,2282,0
2283,prostate cancer,35,37,215,230,"It is possible that analogous to an activated/altered growth factor receptor oncogene, codon 877 mutant AR with altered ligand binding may provide a selective growth advantage in the genesis of a subset of advanced prostate cancer.",8187068_4,0,2283,0
2284,prostate cancer,17,19,125,140,"Although estrogens are used infrequently, antiandrogens are used increasingly in hormonal therapy for patients with advanced prostate cancer.",8187068_5,0,2284,0
2292,diarrhea,13,14,116,124,"An SGLT1 missense mutation underlies hereditary glucose/galactose malabsorption, characterized by potentially fatal diarrhea; conversely, oral rehydration therapy exploits normal transport to alleviate life-threatening diarrhea of infectious origin.",8195156_2,0,2292,0
2293,diarrhea,26,27,219,227,"An SGLT1 missense mutation underlies hereditary glucose/galactose malabsorption, characterized by potentially fatal diarrhea; conversely, oral rehydration therapy exploits normal transport to alleviate life-threatening diarrhea of infectious origin.",8195156_2,0,2293,0
2296,infections,30,31,194,204,"
Mutations at the PEPD locus cause prolidase deficiency (McKusick 170100), a rare autosomal recessive disorder characterized by iminodipeptiduria, skin ulcers, mental retardation, and recurrent infections.",8198124_1,0,2296,0
2303,convulsions,19,20,116,127,"Significant differences were found between PWS patients, SIB controls, and WC controls in the prevalence of febrile convulsions, fever-associated symptoms, and temperature less than 94 degrees F. No differences were noted in any variable between the PWS patients and the ND controls, suggesting that these abnormalities are not unique to PWS, but can occur in any neurodevelopmentally handicapped individual, further suggesting these do not necessarily reflect syndrome-specific hypothalamic abnormalities..",8209890_2,0,2303,0
2314,tumor,6,7,30,35,"
In humans, alteration of the tumor suppressor gene, APC, causes adenomatous polyposis coli, a condition causing predisposition to colorectal cancer.",8252631_1,0,2314,0
2318,hypertrophy,8,9,76,87,The syndrome inconsistently associates characteristic patches of congenital hypertrophy of the retinal pigment epithelium (CHRPE).,8252631_2,0,2318,0
2319,tumor,4,5,23,28,Association of the APC tumor suppressor protein with catenins.,8259519_0,0,2319,0
2320,cancer,13,14,86,92,"
Mutations of APC appear to initiate sporadic and inherited forms of human colorectal cancer.",8259519_1,0,2320,0
2321,tumor,7,8,48,53,These results suggest an important link between tumor initiation and cell adhesion..,8259519_5,0,2321,0
2330,cancer,7,8,57,63,"
We have analyzed a single multi-affected breast/ovarian cancer pedigree (BOV3) and have shown consistent inheritance of markers on chromosome 17q with the disease confirming that this family is due to the BRCA1 gene.",8281142_1,0,2330,0
2332,breast cancer,11,13,70,83,Analysis of 17q haplotypes shows a recombination event in a bilateral breast cancer case which suggests that the BRCA1 gene lies distal to D17S857; D17S857 is thus the new proximal boundary for the region containing BRCA1.,8281142_2,0,2332,0
2344,atherosclerosis,14,15,79,94,"Because LpA-I has been proposed to be more protective than LpA-I  A-II against atherosclerosis, this selective effect on the metabolism of LpA-I  A-II may provide a potential explanation why patients with classic LCAT deficiency and Fish-eye disease are not at increased risk for premature atherosclerosis despite markedly decreased levels of HDL cholesterol and apoA-I",8282802_10,0,2344,0
2346,atherosclerosis,47,48,290,305,"Because LpA-I has been proposed to be more protective than LpA-I  A-II against atherosclerosis, this selective effect on the metabolism of LpA-I  A-II may provide a potential explanation why patients with classic LCAT deficiency and Fish-eye disease are not at increased risk for premature atherosclerosis despite markedly decreased levels of HDL cholesterol and apoA-I",8282802_10,0,2346,0
2350,thrombocytopenia,35,36,212,228,"Because of various features which include the presence of large and normal sized platelets (rather than small platelets) and freedom from significant immune deficiencies, it is likely that the X linked recessive thrombocytopenia in this family is an isolated entity quite distinct from the classical WAS phenotype.",8301658_5,0,2350,0
2353,visual loss,13,15,73,84,"RESULTS  In all but one affected member, symptoms of progressive central visual loss developed in the third or fourth decade of life accompanied by central scotoma and well-demarcated atrophy of the retinal pigment epithelium and choriocapillaris of the macula.",8302543_5,0,2353,0
2354,atrophy,30,31,184,191,"RESULTS  In all but one affected member, symptoms of progressive central visual loss developed in the third or fourth decade of life accompanied by central scotoma and well-demarcated atrophy of the retinal pigment epithelium and choriocapillaris of the macula.",8302543_5,0,2354,0
2367,tumors,11,12,72,78,Positions of the chromosome 22 breakpoints were determined for 19 Ewing tumors.,8307570_8,0,2367,0
2374,tumors,6,7,47,53,Molecular mechanisms of oncogenic mutations in tumors from patients with bilateral and unilateral retinoblastoma.,8346255_0,0,2374,0
2377,tumors,5,6,28,34,"Mutations were found in all tumors, and one-third of the tumors had independent mutations in both alleles neither of which were found in the germ line, confirming their true sporadic nature.",8346255_2,0,2377,0
2378,tumors,11,12,57,63,"Mutations were found in all tumors, and one-third of the tumors had independent mutations in both alleles neither of which were found in the germ line, confirming their true sporadic nature.",8346255_2,0,2378,0
2379,tumors,6,7,35,41,"In the remaining two-thirds of the tumors only one mutation was found, consistent with the loss-of-heterozygosity theory of tumorigenesis.",8346255_3,0,2379,0
2393,cancer,6,7,53,59,"
A susceptibility gene for hereditary breast-ovarian cancer, BRCA1, has been assigned by linkage analysis to chromosome 17q21.",8401501_1,0,2393,0
2394,cancer,7,8,43,49,"We have typed 22 breast and breast-ovarian cancer families with eight polymorphisms from the chromosome 17q12-21 region, including two in the EDH17B2 gene.",8401501_3,0,2394,0
2395,breast cancer,4,6,31,44,Genetic recombination with the breast cancer trait excludes RARA from further consideration as a candidate gene for BRCA1.,8401501_4,0,2395,0
2398,atherosclerosis,8,9,43,58,"
Plasma HDL are a negative risk factor for atherosclerosis.",8408659_1,0,2398,0
2409,death,7,8,60,65,Central nervous system demyelination progresses rapidly and death occurs within a few years.,8441467_3,0,2409,0
2432,bleeding,6,7,43,51,"
The differential diagnosis of the genetic bleeding disorders, hemophilia A and von Willebrand disease, is occasionally confounded by the close molecular relationship of coagulation factor VIII and von Willebrand factor (vWF).",8500791_1,0,2432,0
2436,bleeding,15,16,104,112,"The family we describe demonstrates the recessive inheritance of a recently recognized class of genetic bleeding disorders, we call "" autosomal hemophilia. "" We conclude that vWF mutation may be an under recognized cause of hemophilia, especially in cases where the inheritance pattern is not consistent with X-linked transmission.",8500791_10,0,2436,0
2441,carcinoma,24,25,151,160,"The authors describe two cases of clear cell papillary cystadenoma of the epididymis, both of which were initially confused with metastatic renal cell carcinoma.",8522307_3,0,2441,0
2443,carcinoma,10,11,66,75,"Because clear cell papillary cystadenoma is similar to renal cell carcinoma histologically, and because both occur as components of the von Hippel-Lindau disease complex, the authors analyzed both cases for the presence of mutations in the VHL gene.",8522307_6,0,2443,0
2445,tumors,12,13,59,65,A somatic VHL gene mutation was detected in one of the two tumors by polymerase chain reaction followed by single-strand conformation polymorphism analysis.,8522307_7,0,2445,0
2448,thrombocytopenia,11,12,88,104,Identification of WASP mutations in patients with Wiskott-Aldrich syndrome and isolated thrombocytopenia reveals allelic heterogeneity at the WAS locus.,8528198_0,0,2448,0
2451,thrombocytopenia,35,36,204,220,"To elucidate the range of WASP mutations responsible for WAS, we used PCR-SSCP analysis to screen for WASP gene mutation in 19 unrelated boys with the diagnosis of classical or attenuated WAS or isolated thrombocytopenia.",8528198_2,0,2451,0
2453,thrombocytopenia,8,9,48,64,"While the three mutations found in the isolated thrombocytopenia patients leave the reading frame intact, about one-half of the gene alterations detected in both severe and attenuated WAS patients result in frameshifted transcript and premature translation termination.",8528198_5,0,2453,0
2454,thrombocytopenia,21,22,137,153,These findings therefore confirm the association of WAS with WASP mutation and identify WASP mutation as a cause for isolated congenital thrombocytopenia in males.,8528198_6,0,2454,0
2455,thrombocytopenia,8,9,53,69,"While the WASP gene defects responsible for isolated thrombocytopenia and other mild presentations of WAS do not appear distinct from those resulting in severe WAS, these data indicate that analysis of WASP gene mutation provides a valuable tool for distinguishing the spectrum of WAS patients and the subset of males with isolated thrombocytopenia who represent mild cases of WAS..",8528198_7,0,2455,0
2456,thrombocytopenia,53,54,332,348,"While the WASP gene defects responsible for isolated thrombocytopenia and other mild presentations of WAS do not appear distinct from those resulting in severe WAS, these data indicate that analysis of WASP gene mutation provides a valuable tool for distinguishing the spectrum of WAS patients and the subset of males with isolated thrombocytopenia who represent mild cases of WAS..",8528198_7,0,2456,0
2458,thrombocytopenia,8,9,61,77,WASP gene mutations in Wiskott-Aldrich syndrome and X-linked thrombocytopenia.,8528199_0,0,2458,0
2460,thrombocytopenia,19,20,114,130,"Four amino acid substitutions, Leu27Phe, Thr48Ile, Val75Met and Arg477Lys, were found in patients with congenital thrombocytopenia and no clinically evident immune defect indicating that the WASP gene is the site for mutations in X-linked thrombocytopenia as well as in WAS.",8528199_6,0,2460,0
2461,thrombocytopenia,38,39,239,255,"Four amino acid substitutions, Leu27Phe, Thr48Ile, Val75Met and Arg477Lys, were found in patients with congenital thrombocytopenia and no clinically evident immune defect indicating that the WASP gene is the site for mutations in X-linked thrombocytopenia as well as in WAS.",8528199_6,0,2461,0
2473,breast cancer,10,12,65,78,BRCA1 mutations in a population-based sample of young women with breast cancer.,8531967_0,0,2473,0
2474,ovarian cancer,15,17,84,98,Inherited mutations in the BRCA1 gene are associated with a high risk of breast and ovarian cancer in some families.,8531967_2,0,2474,0
2475,breast cancer,12,14,70,83,"However, little is known about the contribution of BRCA1 mutations to breast cancer in the general population.",8531967_3,0,2475,0
2476,breast cancer,13,15,87,100,We analyzed DNA samples from women enrolled in a population-based study of early-onset breast cancer to assess the spectrum and frequency of germ-line BRCA1 mutations in young women with breast cancer.,8531967_4,0,2476,0
2477,breast cancer,29,31,187,200,We analyzed DNA samples from women enrolled in a population-based study of early-onset breast cancer to assess the spectrum and frequency of germ-line BRCA1 mutations in young women with breast cancer.,8531967_4,0,2477,0
2478,breast cancer,6,8,28,41,"We studied 80 women in whom breast cancer was diagnosed before the age of 35, and who were not selected on the basis of family history.",8531967_6,0,2478,0
2479,ovarian cancer,25,27,135,149,Two of the mutations and three of the rare sequence variants were found among the 39 women who reported no family history of breast or ovarian cancer.,8531967_12,0,2479,0
2481,ovarian cancer,17,19,93,107,The risk of harboring a mutation was not limited to women with family histories of breast or ovarian cancer.,8531967_16,0,2481,0
2482,breast cancer,8,10,50,63,"
Thirty-seven families with four or more cases of breast cancer or breast and ovarian cancer were analyzed for mutations in BRCA1.",8533757_1,0,2482,0
2483,ovarian cancer,13,15,78,92,"
Thirty-seven families with four or more cases of breast cancer or breast and ovarian cancer were analyzed for mutations in BRCA1.",8533757_1,0,2483,0
2484,breast cancer,10,12,68,81,"Expressivity of 185delAG in these families varied, from early-onset breast cancer without ovarian cancer.",8533757_4,0,2484,0
2485,ovarian cancer,13,15,90,104,"Expressivity of 185delAG in these families varied, from early-onset breast cancer without ovarian cancer.",8533757_4,0,2485,0
2486,breast cancer,12,14,76,89,"In one family, penetrance was complete, with females developing early-onset breast cancer or ovarian cancer and the male carrier developing prostatic cancer, whereas, in the other family, penetrance was incomplete and only breast cancer occurred, diagnosed at ages 38-81 years.",8533757_6,0,2486,0
2487,ovarian cancer,15,17,93,107,"In one family, penetrance was complete, with females developing early-onset breast cancer or ovarian cancer and the male carrier developing prostatic cancer, whereas, in the other family, penetrance was incomplete and only breast cancer occurred, diagnosed at ages 38-81 years.",8533757_6,0,2487,0
2488,cancer,23,24,150,156,"In one family, penetrance was complete, with females developing early-onset breast cancer or ovarian cancer and the male carrier developing prostatic cancer, whereas, in the other family, penetrance was incomplete and only breast cancer occurred, diagnosed at ages 38-81 years.",8533757_6,0,2488,0
2490,breast cancer,21,23,119,132,Two novel nonsense mutations led to the loss of mutant BRCA1 transcript in families with 10 and 6 cases of early-onset breast cancer and ovarian cancer.,8533757_7,0,2490,0
2491,ovarian cancer,24,26,137,151,Two novel nonsense mutations led to the loss of mutant BRCA1 transcript in families with 10 and 6 cases of early-onset breast cancer and ovarian cancer.,8533757_7,0,2491,0
2492,cancers,31,32,173,180,"Overall in our series, BRCA1 mutations have been detected in 26 families  16 with positive BRCA1 lod scores, 7 with negative lod scores (reflecting multiple sporadic breast cancers), and 3 not tested for linkage.",8533757_9,0,2492,0
2496,bipolar,10,11,43,50,The greatest sharing was at D18S37  64% in bipolar and recurrent unipolar (RUP) sib pairs (P =. 0006).,8533768_5,0,2496,0
2497,bipolar,27,28,139,146,"In addition, excess sharing of the paternally, but not maternally, transmitted alleles was observed at three markers on 18q  at D18S41, 51 bipolar and RUP sib pairs were concordant for paternally transmitted alleles, and 21 pairs were discordant (P = 0004).",8533768_6,0,2497,0
2498,cancer,9,10,57,63,A high incidence of BRCA1 mutations in 20 breast-ovarian cancer families.,8554067_0,0,2498,0
2499,cancer,5,6,36,42,"
We have analyzed 20 breast-ovarian cancer families, the majority of which show positive evidence of linkage to chromosome 17q12 for germ-line mutations in the BRCA1 gene.",8554067_1,0,2499,0
2501,breast cancer,23,25,147,160,"BRCA1 mutations cosegregating with breast and ovarian cancer susceptibility were identified in 16 families, including 1 family with a case of male breast cancer.",8554067_2,0,2501,0
2503,ovarian cancer,3,5,16,30,"
The breast and ovarian cancer susceptibility gene, BRCA1, has been cloned and shown to encode a zinc-finger protein of unknown function.",8563759_1,0,2503,0
2504,ovarian cancer,15,17,77,91,"Mutations in BRCA1 account for at least 80% of families with both breast and ovarian cancer, as well as some non-familial sporadic ovarian cancers.",8563759_2,0,2504,0
2505,cancers,25,26,139,146,"Mutations in BRCA1 account for at least 80% of families with both breast and ovarian cancer, as well as some non-familial sporadic ovarian cancers.",8563759_2,0,2505,0
2506,cancer,21,22,116,122,"To examine the role of BRCA1 in normal tissue growth and differentiation, and to generate a potential model for the cancer susceptibility associated with loss of BRCA1 function, we have created a mouse line carrying a mutation in one Brca1 allele.",8563759_4,0,2506,0
2508,death,20,21,141,146,"In addition, the neuroepithelium in Brca1-deficient embryos appeared disorganized, with signs of both rapid proliferation and excessive cell death..",8563759_7,0,2508,0
2511,ovarian cancer,8,10,43,57,The murine homolog of the human breast and ovarian cancer susceptibility gene Brca1 maps to mouse chromosome 11D.,8566965_0,0,2511,0
2512,ovarian cancer,6,8,38,52,"
The recently cloned human breast and ovarian cancer susceptibility gene, BRCA1, is located on human chromosome 17q21.",8566965_1,0,2512,0
2517,ovarian cancer,14,16,91,105,"
Several BRCA1 mutations have now been found to occur in geographically diverse breast and ovarian cancer families.",8571953_1,0,2517,0
2518,cancer,32,33,210,216,"To investigate mutation origin and mutation-specific phenotypes due to BRCA1, we constructed a haplotype of nine polymorphic markers within or immediately flanking the BRCA1 locus in a set of 61 breast/ovarian cancer families selected for having one of six recurrent BRCA1 mutations.",8571953_2,0,2518,0
2519,ovarian cancer,15,17,85,99,"A comparison of the six mutations in the relative proportions of cases of breast and ovarian cancer was suggestive of an effect (P =. 069), with 57% of women presumed affected because of the 1294 del 40 BRCA1 mutation having ovarian cancer, compared with 14% of affected women with the splice-site mutation in intron 5 of BRCA1.",8571953_4,0,2519,0
2521,ovarian cancer,13,15,77,91,"
The BRCA1 gene is in large part responsible for hereditary human breast and ovarian cancer.",8575748_1,0,2521,0
2524,ovarian cancer,8,10,55,69,"
Inherited mutations in BRCA1 predispose to breast and ovarian cancer, but the role of BRCA1 in sporadic breast and ovarian cancer has previously been elusive.",8589721_1,0,2524,0
2525,ovarian cancer,20,22,116,130,"
Inherited mutations in BRCA1 predispose to breast and ovarian cancer, but the role of BRCA1 in sporadic breast and ovarian cancer has previously been elusive.",8589721_1,0,2525,0
2526,ovarian cancer,20,22,110,124,"Here, we show that retroviral transfer of the wild-type BRCA1 gene inhibits growth in vitro of all breast and ovarian cancer cell lines tested, but not colon or lung cancer cells or fibroblasts.",8589721_2,0,2526,0
2527,cancer,31,32,166,172,"Here, we show that retroviral transfer of the wild-type BRCA1 gene inhibits growth in vitro of all breast and ovarian cancer cell lines tested, but not colon or lung cancer cells or fibroblasts.",8589721_2,0,2527,0
2528,breast cancer,8,10,40,53,"Mutant BRCA1 has no effect on growth of breast cancer cells; ovarian cancer cell growth is not affected by BRCA1 mutations in the 5 portion of the gene, but is inhibited by 3 BRCA1 mutations.",8589721_3,0,2528,0
2529,ovarian cancer,12,14,61,75,"Mutant BRCA1 has no effect on growth of breast cancer cells; ovarian cancer cell growth is not affected by BRCA1 mutations in the 5 portion of the gene, but is inhibited by 3 BRCA1 mutations.",8589721_3,0,2529,0
2530,ovarian cancer,13,15,84,98,"
Germline mutations in BRCA1 are responsible for most cases of inherited breast and ovarian cancer .",8589722_1,0,2530,0
2531,Ovarian cancer,0,2,0,14,Ovarian cancer risk in BRCA1 carriers is modified by the HRAS1 variable number of tandem repeat (VNTR) locus.,8589723_0,0,2531,0
2533,ovarian cancer,29,31,121,135,"
Women who carry a mutation in the BRCA1 gene (on chromosome 17q21), have an 80% risk of breast cancer and a 40% risk of ovarian cancer by the age of 70 (ref.",8589723_1,0,2533,0
2534,cancer,8,9,39,45,5) is one possible genetic modifier of cancer penetrance.,8589723_5,0,2534,0
2535,cancers,16,17,89,96,"Individuals who have rare alleles of the VNTR have an increased risk of certain types of cancers, including breast cancer (2-4).",8589723_6,0,2535,0
2536,breast cancer,19,21,108,121,"Individuals who have rare alleles of the VNTR have an increased risk of certain types of cancers, including breast cancer (2-4).",8589723_6,0,2536,0
2537,ovarian cancer,15,17,108,122,"To investigate whether the presence of rare HRAS1 alleles increases susceptibility to hereditary breast and ovarian cancer, we have typed a panel of 307 female BRCA1 carriers at this locus using a PCR-based technique.",8589723_7,0,2537,0
2538,ovarian cancer,3,5,13,27,"The risk for ovarian cancer was 2. 11 times greater for BRCA1 carriers harbouring one or two rare HRAS1 alleles, compared to carriers with only common alleles (P = 0. 015).",8589723_8,0,2538,0
2539,ovarian cancer,25,27,148,162,The magnitude of the relative risk associated with a rare HRAS1 allele was not altered by adjusting for the other known risk factors for hereditary ovarian cancer (5).,8589723_9,0,2539,0
2540,breast cancer,2,4,18,31,Susceptibility to breast cancer did not appear to be affected by the presence of rare HRAS1 alleles.,8589723_10,0,2540,0
2541,cancer,19,20,97,103,This study is the first to show the effect of a modifying gene on the penetrance of an inherited cancer syndrome,8589723_11,0,2541,0
2564,Tumor,0,1,0,5,Tumor suppression and apoptosis of human prostate carcinoma mediated by a genetic locus within human chromosome 10pter-q11.,8637912_0,0,2564,0
2566,cancer,1,2,10,16,"
Prostate cancer is the second leading cause of male cancer deaths in the United States. Yet, despite a large international effort, little is known about the molecular mechanisms that underlie this devastating disease.",8637912_1,0,2566,0
2570,tumor,19,20,123,128,We report the functional definition of a novel genetic locus within human chromosome 10pter-q11 that mediates both in vivo tumor suppression and in vitro apoptosis of prostatic adenocarcinoma cells.,8637912_4,0,2570,0
2573,death,8,9,62,67,"Furthermore, the complemented hybrids undergo programmed cell death in vitro via a mechanism that does not require nuclear localization of p53.",8637912_7,0,2573,0
2575,tumor,19,20,114,119,"These data functionally define a novel genetic locus, designated PAC1, for prostate adenocarcinoma 1, involved in tumor suppression of human prostate carcinoma and furthermore strongly suggest that the cell death pathway can be functionally restored in prostatic adenocarcinoma..",8637912_8,0,2575,0
2576,carcinoma,24,25,150,159,"These data functionally define a novel genetic locus, designated PAC1, for prostate adenocarcinoma 1, involved in tumor suppression of human prostate carcinoma and furthermore strongly suggest that the cell death pathway can be functionally restored in prostatic adenocarcinoma..",8637912_8,0,2576,0
