,entities,start_tokens,end_tokens,start_chars,end_chars,text,pmid,label,orig_index,olabel
810,ataxia,11,12,63,69,"
Friedreich ataxia (FRDA), the most common autosomal recessive ataxia, is caused in almost all cases by homozygous intronic expansions resulting in the loss of frataxin, a mitochondrial protein conserved through evolution, and involved in mitochondrial iron homeostasis.",10767347_1,0,810,0
813,death,20,21,130,135,"Surprisingly, in the frataxin knockout mouse, no iron accumulation was observed during embryonic resorption, suggesting that cell death could be due to a mechanism independent of iron accumulation..",10767347_7,0,813,0
819,arthritis,8,9,57,66,Five patients had evidence of a sero-negative peripheral arthritis resembling peripheral psoriatic arthritis and 3 of these were B27 negative.,107868_2,0,819,0
825,psoriasis,19,20,136,145,"These findings are interpreted as suggesting some degree of clinical and genetic heterogeneity in ankylosing spondylitis with genes for psoriasis and inflammatory bowel disease being important in some individuals, particularly those who are B27 negative.",107868_5,0,825,0
834,cancer,11,12,75,81,Founder mutations in the BRCA1 gene in Polish families with breast-ovarian cancer.,10788334_0,0,834,0
835,cancer,9,10,53,59,"The study group consisted of 66 Polish families with cancer who have at least three related females affected with breast or ovarian cancer and who had cancer diagnosed, in at least one of the three affected females, at age < 50 years.",10788334_2,0,835,0
836,ovarian cancer,21,23,124,138,"The study group consisted of 66 Polish families with cancer who have at least three related females affected with breast or ovarian cancer and who had cancer diagnosed, in at least one of the three affected females, at age < 50 years.",10788334_2,0,836,0
837,cancer,26,27,151,157,"The study group consisted of 66 Polish families with cancer who have at least three related females affected with breast or ovarian cancer and who had cancer diagnosed, in at least one of the three affected females, at age < 50 years.",10788334_2,0,837,0
838,cancers,10,11,51,58,"A total of 26 families had both breast and ovarian cancers, 4 families had ovarian cancers only, and 36 families had breast cancers only.",10788334_3,0,838,0
839,cancers,16,17,83,90,"A total of 26 families had both breast and ovarian cancers, 4 families had ovarian cancers only, and 36 families had breast cancers only.",10788334_3,0,839,0
840,cancers,24,25,124,131,"A total of 26 families had both breast and ovarian cancers, 4 families had ovarian cancers only, and 36 families had breast cancers only.",10788334_3,0,840,0
841,ovarian cancer,9,11,62,76,"BRCA1 abnormalities were identified in all four families with ovarian cancer only, in 67% of 27 families with both breast and ovarian cancer, and in 34% of 35 families with breast cancer only.",10788334_8,0,841,0
843,breast cancer,34,36,173,186,"BRCA1 abnormalities were identified in all four families with ovarian cancer only, in 67% of 27 families with both breast and ovarian cancer, and in 34% of 35 families with breast cancer only.",10788334_8,0,843,0
852,cataracts,5,6,31,40,Mice deficient in Six5 develop cataracts: implications for myotonic dystrophy.,10802667_0,0,852,0
857,cataracts,37,38,220,229,"
Expansion of a CTG trinucleotide repeat in the 3 UTR of the gene DMPK at the DM1 locus on chromosome 19 causes myotonic dystrophy, a dominantly inherited disease characterized by skeletal muscle dystrophy and myotonia, cataracts and cardiac conduction defects.",10802667_1,0,857,0
858,myopathy,17,18,89,97,"Targeted deletion of Dm15, the mouse orthologue of human DMPK, produced mice with a mild myopathy and cardiac conduction abnormalities, but without other features of myotonic dystrophy, such as myotonia and cataracts.",10802667_2,0,858,0
861,cataracts,35,36,207,216,"Targeted deletion of Dm15, the mouse orthologue of human DMPK, produced mice with a mild myopathy and cardiac conduction abnormalities, but without other features of myotonic dystrophy, such as myotonia and cataracts.",10802667_2,0,861,0
863,cataract,9,10,60,68,"Our results suggest that SIX5 deficiency contributes to the cataract phenotype in myotonic dystrophy, and that myotonic dystrophy represents a multigenic disorder..",10802667_7,0,863,0
866,cataracts,11,12,64,73,Heterozygous loss of Six5 in mice is sufficient to cause ocular cataracts.,10802668_0,0,866,0
870,arrhythmia,19,20,119,129,"
Myotonic dystrophy (DM) is an autosomal dominant disorder characterized by skeletal muscle wasting, myotonia, cardiac arrhythmia, hyperinsulinaemia, mental retardation and ocular cataracts.",10802668_1,0,870,0
871,cataracts,27,28,180,189,"
Myotonic dystrophy (DM) is an autosomal dominant disorder characterized by skeletal muscle wasting, myotonia, cardiac arrhythmia, hyperinsulinaemia, mental retardation and ocular cataracts.",10802668_1,0,871,0
876,cataract,9,10,54,62,Our results demonstrate that the rate and severity of cataract formation is inversely related to Six5 dosage and is temporally progressive.,10802668_9,0,876,0
877,cataract,11,12,64,72,"Thus, altered ion homeostasis within the lens may contribute to cataract formation.",10802668_11,0,877,0
878,cataracts,2,3,10,19,"As ocular cataracts are a characteristic feature of DM, these results demonstrate that decreased SIX5 transcription is important in the aetiology of DM.",10802668_12,0,878,0
886,cancer,13,14,96,102,"There are strong parallels between the pattern of radiosensitivity, chromosomal instability and cancer predisposition in A-T patients and that in patients with Nijmegen breakage syndrome (NBS).",10802669_3,0,886,0
889,ovarian cancer,6,8,55,69,Clinicopathologic features of BRCA-linked and sporadic ovarian cancer.,10807385_0,0,889,0
890,cancers,5,6,34,41,"
CONTEXT  Most hereditary ovarian cancers are associated with germline mutations in BRCA1 or BRCA2.",10807385_1,0,890,0
891,ovarian cancer,11,13,72,86,"Attempts to define the clinical significance of BRCA mutation status in ovarian cancer have produced conflicting results, especially regarding survival.",10807385_2,0,891,0
894,cancers,14,15,86,93,"DESIGN AND SETTING  Retrospective cohort study of a consecutive series of 933 ovarian cancers diagnosed and treated at our institution, which is a comprehensive cancer center as designated by the National Cancer Institute, over a 12-year period (December 1986 to August 1998).",10807385_4,0,894,0
895,cancer,26,27,161,167,"DESIGN AND SETTING  Retrospective cohort study of a consecutive series of 933 ovarian cancers diagnosed and treated at our institution, which is a comprehensive cancer center as designated by the National Cancer Institute, over a 12-year period (December 1986 to August 1998).",10807385_4,0,895,0
896,Cancer,33,34,205,211,"DESIGN AND SETTING  Retrospective cohort study of a consecutive series of 933 ovarian cancers diagnosed and treated at our institution, which is a comprehensive cancer center as designated by the National Cancer Institute, over a 12-year period (December 1986 to August 1998).",10807385_4,0,896,0
898,cancers,3,4,20,27,"RESULTS  Hereditary cancers were rarely diagnosed before age 40 years and were common after age 60 years, with mean age at diagnosis being significantly younger for BRCA1- vs BRCA2-linked patients (54 vs 62 years; P =.",10807385_9,0,898,0
900,cancers,3,4,22,29,Those with hereditary cancers had improved survival compared with the nonhereditary group (P =. 004).,10807385_13,0,900,0
901,cancers,3,4,14,21,"For stage III cancers, BRCA mutation status was an independent prognostic variable (P =. 03).",10807385_14,0,901,0
902,cancers,6,7,57,64,"CONCLUSIONS  Although BRCA-associated hereditary ovarian cancers in this population have surgical and pathological characteristics similar to those of sporadic cancers, advanced-stage hereditary cancer patients survive longer than nonhereditary cancer patients.",10807385_15,0,902,0
903,cancers,20,21,160,167,"CONCLUSIONS  Although BRCA-associated hereditary ovarian cancers in this population have surgical and pathological characteristics similar to those of sporadic cancers, advanced-stage hereditary cancer patients survive longer than nonhereditary cancer patients.",10807385_15,0,903,0
905,cancer,30,31,245,251,"CONCLUSIONS  Although BRCA-associated hereditary ovarian cancers in this population have surgical and pathological characteristics similar to those of sporadic cancers, advanced-stage hereditary cancer patients survive longer than nonhereditary cancer patients.",10807385_15,0,905,0
906,cancers,9,10,65,72,Age penetrance is greater for BRCA1-linked than for BRCA2-linked cancers in this population.,10807385_16,0,906,0
909,fever,14,15,89,94,"
Familial Mediterranean fever (FMF) is a recessive disorder characterized by episodes of fever and neutrophil-mediated serosal inflammation.",10807793_1,0,909,0
910,inflammation,18,19,127,139,"
Familial Mediterranean fever (FMF) is a recessive disorder characterized by episodes of fever and neutrophil-mediated serosal inflammation.",10807793_1,0,910,0
913,cancer,24,25,173,179,"
Mutations at the ataxia-telangiectasia (A-T) locus on chromosome band 11q22 cause a distinctive autosomal recessive syndrome in homozygotes and predispose heterozygotes to cancer, ischemic heart disease, and early mortality.",10817650_1,0,913,0
917,fever,14,15,89,94,"
Familial Mediterranean fever (FMF) is a recessive disorder characterized by episodes of fever with serositis or synovitis.",10818206_1,0,917,0
924,ovarian cancer,37,39,216,230,"To do this, a collaborative screening study was set up that involved 39 institutions from 19 countries and included 3, 580 unrelated individuals with a family history of the disease and 934 early-onset breast and/or ovarian cancer cases.",10827109_4,0,924,0
928,carcinoma,31,32,216,225,"
Von Hippel-Lindau (VHL) disease is a hereditary tumor syndrome characterized by predisposition for bilateral and multi-centric hemangioblastoma in the retina and central nervous system, pheochromocytoma, renal cell carcinoma, and cysts in the kidney, pancreas, and epididymis.",10830910_1,0,928,0
935,ataxia,10,11,57,63,"
Friedreich ataxia (FRDA), the most frequently inherited ataxia, is due in the vast majority of cases to a large expansion of an intronic GAA repeat.",10830915_1,0,935,0
938,cancer,18,19,121,127,"
Ataxia-telangiectasia (A-T) and Nijmegen breakage syndrome (NBS) are recessive genetic disorders with susceptibility to cancer and similar cellular phenotypes.",10839544_1,0,938,0
940,hypersensitivity,16,17,115,131,"This response includes S-phase checkpoint activation, formation of the NBS1/Mrel1/Rad50 nuclear foci and rescue of hypersensitivity to ionizing radiation.",10839544_7,0,940,0
971,death,7,8,55,60,"
Heterozygous mutations encoding abnormal forms of the death receptor Fas dominantly interfere with Fas-induced lymphocyte apoptosis in human autoimmune lymphoproliferative syndrome.",10875918_1,0,971,0
995,convulsions,3,4,27,38,"
Benign familial infantile convulsions (BFIC) is a rare autosomal dominant epilepsy syndrome.",10923035_1,0,995,0
998,seizures,7,8,48,56,"Patients present with partial, then generalized seizures, with onset at age three months.",10923035_3,0,998,0
999,seizures,1,2,4,12,"The seizures usually spontaneously cease after one year without treatment, leaving no neurological abnormalities.",10923035_4,0,999,0
1000,epilepsy,27,28,154,162,"The sodium channel beta1 subunit gene (SCN1B) maps to this candidate region and has been shown to be involved in one Australian pedigree with generalized epilepsy and febrile seizures "" plus "" (GEFS +).",10923035_6,0,1000,0
1001,seizures,30,31,175,183,"The sodium channel beta1 subunit gene (SCN1B) maps to this candidate region and has been shown to be involved in one Australian pedigree with generalized epilepsy and febrile seizures "" plus "" (GEFS +).",10923035_6,0,1001,0
1004,tumors,11,12,79,85,Patients with FAP typically develop hundreds to thousands of benign colorectal tumors and early-onset colorectal cancer.,10924409_2,0,1004,0
1006,tumors,21,22,114,120,"A subset of germline APC mutations results in an attenuated FAP (AFAP) phenotype, in which patients develop fewer tumors and develop them at an older age.",10924409_3,0,1006,0
1007,tumors,20,21,119,125,Mutation analysis showed that both APC (AS9) and the wild-type APC alleles were somatically mutated in most colorectal tumors from these patients.,10924409_7,0,1007,0
1008,tumors,17,18,90,96,"Functional analysis showed that 4666insA, a common somatic mutation in APC (AS9) in these tumors, did not inactivate the wild-type APC.",10924409_8,0,1008,0
1009,tumors,13,14,73,79,Our results indicate that carriers of APC (AS9) develop fewer colorectal tumors than do typical patients with FAP because somatic inactivation of both APC alleles is necessary for colorectal tumorigenesis.,10924409_9,0,1009,0
1010,tumors,6,7,43,49,"However, these patients develop colorectal tumors more frequently than does the general population because APC (AS9) is inactivated by mutations that do not inactivate the wild-type APC..",10924409_10,0,1010,0
1020,toxicity,13,14,107,115,Amino-terminal fragments of mutant huntingtin show selective accumulation in striatal neurons and synaptic toxicity.,10932179_0,0,1020,0
1022,breast cancer,13,15,90,103,BRCA1 is associated with a human SWI/SNF-related complex: linking chromatin remodeling to breast cancer.,10943845_0,0,1022,0
1023,tumor,4,5,27,32,"
Germline mutations in the tumor suppressor gene, BRCA1, predispose individuals to breast and ovarian cancers.",10943845_1,0,1023,0
1024,cancers,16,17,102,109,"
Germline mutations in the tumor suppressor gene, BRCA1, predispose individuals to breast and ovarian cancers.",10943845_1,0,1024,0
1027,tumors,18,19,115,121,"
The adenomatous polyposis coli gene (APC) is mutated in familial adenomatous polyposis and in sporadic colorectal tumors.",10947987_1,0,1027,0
1028,Cancer,17,18,123,129,"
The axonal chemoattractant netrin-1 guides spinal commissural axons by activating its receptor DCC (Deleted in Colorectal Cancer ).",10958786_1,0,1028,0
1033,myopathy,9,10,64,72,"Mice that expressed expanded CUG repeats developed myotonia and myopathy, whereas mice expressing a nonexpanded repeat did not.",10976074_4,0,1033,0
1040,ataxia,16,17,86,92,"episodic ataxia type 2 (EA-2), familial hemiplegic migraine (FHM) and spinocerebellar ataxia 6 (SCA6).",10987655_2,0,1040,0
1041,migraine,17,18,104,112,"Furthermore, this mutation has been detected in a family member with mild clinical signs including only migraine.",10987655_10,0,1041,0
1042,edema,13,14,91,96,"Patients lacking this serum protein are essentially asymptomatic, apart from minimal ankle edema and ease of fatigue.",1127526_2,0,1042,0
1044,hypotension,33,34,214,225,"Apparent compensatory mechanisms which come into play when serum albumin is low include prolonged half-life of albumin and transferrin, an increase in serum globulins, beta lipoprotein, and glycoproteins, arterial hypotension with reduced capillary hydrostatic pressure, and the ability to respond with rapid sodium and chloride diuresis in response to small volume changes.",1127526_3,0,1044,0
1048,jaundice,10,11,97,105,Glucose-6-phosphate dehydrogenase variants from Italian subjects associated with severe neonatal jaundice.,1201235_0,0,1048,0
1049,jaundice,12,13,65,73,"In the present work these three cases, each with severe neonatal jaundice, are reported.",1201235_6,0,1049,0
1058,cancers,35,36,197,204,"Heterozygotes for the gene for A-T are thought to comprise about 1% of the general population and, therefore, it is important to know whether this gene also predisposes the heterozygous carrier to cancers.",1248000_2,0,1058,0
1059,death,9,10,46,51,"For this reason, we compared the incidence of death from malignant neoplasms in 2 families of patients with A-T to that expected in a random sample of the general population.",1248000_4,0,1059,0
1061,deaths,3,4,14,20,"There were 59 deaths from malignant neoplasms in relatives dying before age 75, compared to 42.",1248000_5,0,1061,0
1063,cancer,14,15,72,78,A-T heterozygotes may comprise more than 5% of all persons dying from a cancer before age 45.,1248000_8,0,1063,0
1071,dermatitis,13,14,104,114,"
Analbuminemia was fortuitously detected in a nonedematous 12-year-old American Indian girl with atopic dermatitis, mild bronchial asthma, a mild seizure disorder, and hyperlipoproteinemia with a corneal arcus.",1269174_1,0,1071,0
1073,seizure,21,22,146,153,"
Analbuminemia was fortuitously detected in a nonedematous 12-year-old American Indian girl with atopic dermatitis, mild bronchial asthma, a mild seizure disorder, and hyperlipoproteinemia with a corneal arcus.",1269174_1,0,1073,0
1129,tumors,26,27,158,164,"
High level expression of the nm23-H1 gene, which encodes for a nucleoside diphosphate kinase, has been found to correlate with diminished metastasis in some tumors but not in others.",1311721_1,0,1129,0
1131,tumor,19,20,114,119,"In neuroblastoma, higher levels of p19/nm23, which are associated with amplification of the N-myc oncogene, large tumor mass, and metastasis, were observed in advanced stage tumors compared with limited stage disease.",1311721_3,0,1131,0
1132,tumors,30,31,174,180,"In neuroblastoma, higher levels of p19/nm23, which are associated with amplification of the N-myc oncogene, large tumor mass, and metastasis, were observed in advanced stage tumors compared with limited stage disease.",1311721_3,0,1132,0
1134,tumors,9,10,59,65,"Because of the variable expression of nm23-H1 in different tumors, we have investigated the relationship between amounts of the protein and cell proliferation.",1311721_4,0,1134,0
1142,hypertrophy,19,20,112,123,"
We report familial adenomatous polyposis coli (FAPC) with epidermoid cysts, osteomata, and areas of congenital hypertrophy of the retinal pigment epithelium (CHRPEs) in a male patient and his maternal aunt, both of whom suffered a mild to moderate degree of mental handicap.",1313112_1,0,1142,0
1150,infections,13,14,61,71,"
A 24 year old male with a history of eczema, recurrent mild infections, and thrombocytopenia consistent with the Wiskott-Aldrich syndrome (WAS) presented with a mediastinal mass, generalized lymphadenopathy, splenomegaly, and severe thrombocytopenia.",1316718_1,0,1150,0
1151,thrombocytopenia,16,17,77,93,"
A 24 year old male with a history of eczema, recurrent mild infections, and thrombocytopenia consistent with the Wiskott-Aldrich syndrome (WAS) presented with a mediastinal mass, generalized lymphadenopathy, splenomegaly, and severe thrombocytopenia.",1316718_1,0,1151,0
1153,lymphadenopathy,32,33,192,207,"
A 24 year old male with a history of eczema, recurrent mild infections, and thrombocytopenia consistent with the Wiskott-Aldrich syndrome (WAS) presented with a mediastinal mass, generalized lymphadenopathy, splenomegaly, and severe thrombocytopenia.",1316718_1,0,1153,0
1155,thrombocytopenia,38,39,234,250,"
A 24 year old male with a history of eczema, recurrent mild infections, and thrombocytopenia consistent with the Wiskott-Aldrich syndrome (WAS) presented with a mediastinal mass, generalized lymphadenopathy, splenomegaly, and severe thrombocytopenia.",1316718_1,0,1155,0
1162,cancer,15,16,90,96,"The APC gene, responsible for familial adenomatous polyposis, is mutated in human gastric cancer.",1317264_0,0,1162,0
1163,cancer,2,3,18,24,"
Although gastric cancer is the most common cancer in the world, genetic changes during its carcinogenesis are not well understood.",1317264_1,0,1163,0
1164,cancer,7,8,44,50,"
Although gastric cancer is the most common cancer in the world, genetic changes during its carcinogenesis are not well understood.",1317264_1,0,1164,0
1165,carcinogenesis,16,17,92,106,"
Although gastric cancer is the most common cancer in the world, genetic changes during its carcinogenesis are not well understood.",1317264_1,0,1165,0
1166,cancers,3,4,19,26,"Since some gastric cancers are considered to originate from the intestinal metaplasia, it is likely that the adenomatous polyposis coli (APC) gene, the mutation of which causes adenomatous polyps in the colon, is associated with carcinogenesis of gastric cancer.",1317264_2,0,1166,0
1170,carcinogenesis,40,41,229,243,"Since some gastric cancers are considered to originate from the intestinal metaplasia, it is likely that the adenomatous polyposis coli (APC) gene, the mutation of which causes adenomatous polyps in the colon, is associated with carcinogenesis of gastric cancer.",1317264_2,0,1170,0
1171,cancer,43,44,255,261,"Since some gastric cancers are considered to originate from the intestinal metaplasia, it is likely that the adenomatous polyposis coli (APC) gene, the mutation of which causes adenomatous polyps in the colon, is associated with carcinogenesis of gastric cancer.",1317264_2,0,1171,0
1172,cancers,9,10,47,54,"Based on this idea, DNAs isolated from gastric cancers were examined by means of a RNase protection analysis coupled with polymerase chain reaction followed by sequencing of the polymerase chain reaction products.",1317264_3,0,1172,0
1173,tumors,14,15,72,78,"By screening nearly one-half of the coding region of the APC gene in 44 tumors, somatic mutations were detected in three tumors  a missense mutation, a nonsense mutation, and a 5-base pair deletion resulting in a frame shift which causes truncation of the gene product.",1317264_4,0,1173,0
1174,tumors,22,23,121,127,"By screening nearly one-half of the coding region of the APC gene in 44 tumors, somatic mutations were detected in three tumors  a missense mutation, a nonsense mutation, and a 5-base pair deletion resulting in a frame shift which causes truncation of the gene product.",1317264_4,0,1174,0
1175,carcinogenesis,17,18,96,110,These results suggest that the mutation of the APC gene also plays an important role during the carcinogenesis of at least some gastric cancers..,1317264_5,0,1175,0
1176,cancers,23,24,136,143,These results suggest that the mutation of the APC gene also plays an important role during the carcinogenesis of at least some gastric cancers..,1317264_5,0,1176,0
1185,cancer,14,15,101,107,"
Familial adenomatous polyposis (FAP) is a dominantly inherited condition predisposing to colorectal cancer.",1324223_1,0,1185,0
1188,carcinoma,13,14,66,75,1 megabase pairs of DNA around the MCC (for mutated in colorectal carcinoma) and APC (for adenomatous polyposis coli) genes at 5q21 have been isolated and characterized.,1325652_2,0,1188,0
1193,nephropathy,13,14,77,88,"
Patients with the Denys-Drash syndrome (Wilms tumor, genital anomalies, and nephropathy) have been demonstrated to carry de novo constitutional mutations in WT1, the Wilms tumor gene at chromosome 11p13.",1327525_1,0,1193,0
1210,tumors,8,9,48,54,Somatic mutations of the APC gene in colorectal tumors: mutation cluster region in the APC gene.,1338904_0,0,1210,0
1213,tumors,15,16,67,73,"In addition to loss of heterozygosity (LOH) at the APC locus in 30 tumors, 43 other somatic mutations were detected.",1338904_2,0,1213,0
1214,tumors,1,2,11,17,Twenty-two tumors had frameshift mutations due to deletion or insertion; nineteen of them were deletions of one to 31 bp and three were a 1-bp insertion.,1338904_4,0,1214,0
1215,tumor,1,2,4,9,One tumor had a 1-bp deletion in an intron near the splicing site.,1338904_5,0,1215,0
1216,tumors,14,15,62,68,"Combining these data and the results of LOH, more than 80% of tumors (14 adenomas and 39 carcinomas) had at least one mutation in the APC gene, of which more than 60% (9 adenomas and 23 carcinomas) had two mutations.",1338904_8,0,1216,0
1217,tumors,21,22,136,142,These results strongly suggest that somatic mutations of the APC gene are associated with development of a great majority of colorectal tumors..,1338904_9,0,1217,0
1220,nephropathy,8,9,56,67,"
The Denys-Drash syndrome is characterised by a typical nephropathy, genital abnormalities and also predisposes to the development of Wilms tumor.",1338906_1,0,1220,0
1243,carcinoma,2,3,19,28,An adrenocorotical carcinoma was studied in a patient with a family history of FAP.,1351034_2,0,1243,0
1246,tumors,13,14,74,80,This is the first demonstration of LOH at the APC locus in adrenocortical tumors.,1351034_4,0,1246,0
1247,tumor,13,14,72,77,"The present results and our previous data on LOH in a recurring desmoid tumor suggest that the heterozygous mutant/wild-type condition of the APC gene may give rise to benign tumors, and that functional loss of this gene leads to development of tumors not only in the colon but also in other various parts of the body in FAP patients..",1351034_5,0,1247,0
1248,tumors,29,30,175,181,"The present results and our previous data on LOH in a recurring desmoid tumor suggest that the heterozygous mutant/wild-type condition of the APC gene may give rise to benign tumors, and that functional loss of this gene leads to development of tumors not only in the colon but also in other various parts of the body in FAP patients..",1351034_5,0,1248,0
1249,tumors,42,43,245,251,"The present results and our previous data on LOH in a recurring desmoid tumor suggest that the heterozygous mutant/wild-type condition of the APC gene may give rise to benign tumors, and that functional loss of this gene leads to development of tumors not only in the colon but also in other various parts of the body in FAP patients..",1351034_5,0,1249,0
1251,tumors,25,26,175,181,"Certain families, however, show an unusual low-penetrance phenotype with many individuals being unaffected, unilaterally affected, or with evidence of spontaneously regressed tumors.",1352883_2,0,1251,0
1269,vasculitis,25,26,154,164,A family with inherited deficiency of complement factor 2 (C2) is described in which two family members with homozygous C2 deficiency developed cutaneous vasculitis and sicca syndrome.,1361318_2,0,1269,0
