,entities,start_tokens,end_tokens,start_chars,end_chars,text,pmid,label,orig_index,olabel
1819,cataracts,21,22,128,137,"Moreover, G6PD deficiency should be added to other conditions, such as the galactosemic states and riboflavin deficiency, where cataracts represent a sensitive indicator of metabolic abnormalities of the RBC..",7458742_5,0,1819,0
1820,cardiomyopathy,10,11,97,111,Molecular basis of human mitochondrial very-long-chain acyl-CoA dehydrogenase deficiency causing cardiomyopathy and sudden death in childhood.,7479827_0,0,1820,0
1821,death,13,14,123,128,Molecular basis of human mitochondrial very-long-chain acyl-CoA dehydrogenase deficiency causing cardiomyopathy and sudden death in childhood.,7479827_0,0,1821,0
1822,death,11,12,75,80,"Defects in enzymes of the beta-oxidation pathway cause sudden, unexplained death in childhood, acute hepatic encephalopathy or liver failure, skeletal myopathy, and cardiomyopathy.",7479827_2,0,1822,0
1825,cardiomyopathy,26,27,165,179,"Defects in enzymes of the beta-oxidation pathway cause sudden, unexplained death in childhood, acute hepatic encephalopathy or liver failure, skeletal myopathy, and cardiomyopathy.",7479827_2,0,1825,0
1827,cardiac arrest,24,26,171,185,Polymerase chain reaction amplification of VLCAD mRNA and genomic exons defined the molecular defects in two patients with VLCAD deficiency who presented with unexplained cardiac arrest and cardiomyopathy.,7479827_5,0,1827,0
1828,cardiomyopathy,27,28,190,204,Polymerase chain reaction amplification of VLCAD mRNA and genomic exons defined the molecular defects in two patients with VLCAD deficiency who presented with unexplained cardiac arrest and cardiomyopathy.,7479827_5,0,1828,0
1830,cardiomyopathy,24,25,174,188,This initial delineation of human mutations in VLCAD suggests that VLCAD deficiency reduces myocardial fatty acid beta-oxidation and energy production and is associated with cardiomyopathy and sudden death in childhood.,7479827_8,0,1830,0
1831,death,27,28,200,205,This initial delineation of human mutations in VLCAD suggests that VLCAD deficiency reduces myocardial fatty acid beta-oxidation and energy production and is associated with cardiomyopathy and sudden death in childhood.,7479827_8,0,1831,0
1833,tumor,26,27,157,162,"
The BRCA1 gene product was identified as a 220-kilodalton nuclear phosphoprotein in normal cells, including breast ductal epithelial cells, and in 18 of 20 tumor cell lines derived from tissues other than breast and ovary.",7481765_1,0,1833,0
1835,breast cancer,19,21,122,135,Absence of BRCA1 or aberrant subcellular location was also observed to a variable extent in histological sections of many breast cancer biopsies.,7481765_3,0,1835,0
1836,cancers,15,16,99,106,"These findings suggest that BRCA1 abnormalities may be involved in the pathogenesis of many breast cancers, sporadic as well as familial..",7481765_4,0,1836,0
1839,ovarian cancer,9,11,51,65,Germline mutations of the BRCA1 gene in breast and ovarian cancer families provide evidence for a genotype-phenotype correlation.,7493024_0,0,1839,0
1840,breast cancer,21,23,97,110,"
Mutations in the BRCA1 gene, discovered in 1994, are associated with an 80-90% lifetime risk of breast cancer.",7493024_1,0,1840,0
1841,ovarian cancer,11,13,61,75,We have analysed 60 families with a history of breast and/or ovarian cancer for germline mutations in BRCA1.,7493024_2,0,1841,0
1842,cancer,21,22,122,128,We observed a significant correlation between the location of the mutation in the gene and the ratio of breast to ovarian cancer incidence within each family.,7493024_4,0,1842,0
1843,ovarian cancer,24,26,127,141,Our data suggest a transition in risk such that mutations in the 3 third of the gene are associated with a lower proportion of ovarian cancer.,7493024_5,0,1843,0
1844,infection,11,12,89,98,Hereditary deficiency of the seventh component of complement and recurrent meningococcal infection: investigations of an Irish family using a novel haemolytic screening assay for complement activity and C7 M/N allotyping.,7523157_0,0,1844,0
1845,infection,7,8,71,80,"
Terminal complement component deficiency predisposes to meningococcal infection and is inherited in an autosomal co-dominant manner.",7523157_1,0,1845,0
1846,infection,15,16,83,92,"An Irish family is described, in which 2 of 3 brothers had recurrent meningococcal infection.",7523157_2,0,1846,0
1847,infection,12,13,95,104,Complement screening should be carried out in any individual suffering recurrent meningococcal infection or infection with an uncommon meningococcal serogroup.,7523157_6,0,1847,0
1848,infection,14,15,108,117,Complement screening should be carried out in any individual suffering recurrent meningococcal infection or infection with an uncommon meningococcal serogroup.,7523157_6,0,1848,0
1849,infection,13,14,109,118,Identification of complement deficient patients allows the implementation of strategies to prevent recurrent infection..,7523157_7,0,1849,0
1862,ovarian cancer,7,9,38,52,A strong candidate for the breast and ovarian cancer susceptibility gene BRCA1.,7545954_0,0,1862,0
1863,ovarian cancer,15,17,97,111,"
A strong candidate for the 17q-linked BRCA1 gene, which influences susceptibility to breast and ovarian cancer, has been identified by positional cloning methods.",7545954_1,0,1863,0
1864,ovarian cancer,10,12,72,86,Identification of BRCA1 should facilitate early diagnosis of breast and ovarian cancer susceptibility in some individuals as well as a better understanding of breast cancer biology..,7545954_6,0,1864,0
1865,breast cancer,23,25,159,172,Identification of BRCA1 should facilitate early diagnosis of breast and ovarian cancer susceptibility in some individuals as well as a better understanding of breast cancer biology..,7545954_6,0,1865,0
1870,cataracts,11,12,62,71,One PAX6 mutation found in the PST region was associated with cataracts in an aniridia family.,7550230_5,0,1870,0
1876,ovarian cancer,32,34,184,198,"
Since BRCA1, the first major gene responsible for inherited breast cancer, was cloned, more than 50 unique mutations have been detected in the germline of individuals with breast and ovarian cancer.",7550349_1,0,1876,0
1877,breast cancer,18,20,91,104,"In high-risk pedigrees, female carriers of BRCA1 mutations have an 80-90% lifetime risk of breast cancer, and a 40-50% risk of ovarian cancer.",7550349_2,0,1877,0
1878,ovarian cancer,29,31,127,141,"In high-risk pedigrees, female carriers of BRCA1 mutations have an 80-90% lifetime risk of breast cancer, and a 40-50% risk of ovarian cancer.",7550349_2,0,1878,0
1879,ovarian cancer,11,13,68,82,"However, the mutation stats of individuals unselected for breast or ovarian cancer has not been determined, and it is not known whether mutations in such individuals confer the same risk of cancer as in individuals from the high-risk families studied so far.",7550349_3,0,1879,0
1880,cancer,33,34,190,196,"However, the mutation stats of individuals unselected for breast or ovarian cancer has not been determined, and it is not known whether mutations in such individuals confer the same risk of cancer as in individuals from the high-risk families studied so far.",7550349_3,0,1880,0
1881,cancer,33,34,229,235,"Following the finding of a 185delAG frameshift mutation in several Ashkenazi Jewish breast/ovarian families, we have determined the frequency of this mutation in 858 Ashkenazim seeking genetic testing for conditions unrelated to cancer, and in 815 reference individuals not selected for ethnic origin.",7550349_4,0,1881,0
1882,ovarian cancer,22,24,128,142,Our results suggest that one in a hundred women of Ashkenazi descent may be at especially high risk of developing breast and/or ovarian cancer.,7550349_7,0,1882,0
1884,ataxia,14,15,106,112,Marked phenotypic heterogeneity associated with expansion of a CAG repeat sequence at the spinocerebellar ataxia 3/Machado-Joseph disease locus.,7573040_0,0,1884,0
1886,ataxia,2,3,21,27,"
The spinocerebellar ataxia 3 locus (SCA3) for type I autosomal dominant cerebellar ataxia (ADCA type I), a clinically and genetically heterogeneous group of neurodegenerative disorders, has been mapped to chromosome 14q32.",7573040_1,0,1886,0
1891,atrophy,31,32,210,217,We show here that the disease gene segregating in each of three French ADCA type I kindreds and in a French family with neuropathological findings suggesting the ataxochoreic form of dentatorubropallidoluysian atrophy carries an expanded CAG repeat sequence located at the same locus as that for MJD.,7573040_3,0,1891,0
1901,thrombocytopenia,6,7,53,69,The Wiskott-Aldrich syndrome and X-linked congenital thrombocytopenia are caused by mutations of the same gene.,7579347_0,0,1901,0
1903,thrombocytopenia,13,14,87,103,"
The Wiskott-Aldrich syndrome (WAS) is an X-linked recessive disorder characterized by thrombocytopenia, small platelets, eczema, recurrent infections, and immunodeficiency.",7579347_1,0,1903,0
1905,infections,21,22,140,150,"
The Wiskott-Aldrich syndrome (WAS) is an X-linked recessive disorder characterized by thrombocytopenia, small platelets, eczema, recurrent infections, and immunodeficiency.",7579347_1,0,1905,0
1906,thrombocytopenia,15,16,89,105,"Besides the classic WAS phenotype, there is a group of patients with congenital X-linked thrombocytopenia (XLT) who have small platelets but only transient eczema, if any, and minimal immune deficiency.",7579347_2,0,1906,0
1914,hypertrophy,31,32,186,197,"No linkage or molecular genetic data are as yet available on myotonia levior characterized by milder symptoms and later onset of myotonia than in Thomsens disease, and absence of muscle hypertrophy.",7581380_4,0,1914,0
1927,atherosclerotic,14,15,93,108,This was the first reported subject homozygous for the CETP deficiency who also demonstrated atherosclerotic symptoms.,7605382_10,0,1927,0
1928,cancer,8,9,56,62,"Detection of eight BRCA1 mutations in 10 breast/ovarian cancer families, including 1 family with male breast cancer.",7611277_0,0,1928,0
1929,breast cancer,16,18,102,115,"Detection of eight BRCA1 mutations in 10 breast/ovarian cancer families, including 1 family with male breast cancer.",7611277_0,0,1929,0
1930,breast cancer,19,21,137,150,"
Genetic epidemiological evidence suggests that mutations in BRCA1 may be responsible for approximately one half of early onset familial breast cancer and the majority of familial breast/ovarian cancer.",7611277_1,0,1930,0
1931,cancer,27,28,195,201,"
Genetic epidemiological evidence suggests that mutations in BRCA1 may be responsible for approximately one half of early onset familial breast cancer and the majority of familial breast/ovarian cancer.",7611277_1,0,1931,0
1932,cancer,20,21,126,132,"The recent cloning of BRCA1 allows for the direct detection of mutations, but the feasibility of presymptomatic screening for cancer susceptibility is unknown.",7611277_2,0,1932,0
1933,breast cancer,21,23,118,131,"We analyzed genomic DNA from one affected individual from each of 24 families with at least three cases of ovarian or breast cancer, using SSCP assays.",7611277_3,0,1933,0
1934,prostate cancer,14,16,83,98,A frameshift mutation was detected in a male proband affected with both breast and prostate cancer.,7611277_7,0,1934,0
1938,ovarian cancer,9,11,65,79,These results provide further evidence that inherited breast and ovarian cancer can occur as a consequence of a wide array of BRCA1 mutations.,7611277_10,0,1938,0
1939,breast cancer,10,12,48,61,"The finding of a mutation in a family with male breast cancer, not previously thought to be related to BRCA1, also illustrates the potential difficulties of genetic counseling for individuals known to carry mutations..",7611277_12,0,1939,0
1947,tumors,26,27,185,191,"
Chimeric transcription factors, created by gene fusions as the result of chromosomal translocations, have been implicated in the pathogenesis of several pathologically disparate solid tumors.",7630639_1,0,1947,0
1949,tumor,9,10,53,58,We show that the native PAX3/FKHR protein present in tumor cells with this translocation has transcriptional characteristics similar to the in vitro expressed protein.,7630639_5,0,1949,0
1954,tumor,21,22,137,142,These results suggest that mutation of CDK4 can create a tumor-specific antigen and can disrupt the cell-cycle regulation exerted by the tumor suppressor p16INK4a..,7652577_6,0,1954,0
1955,ovarian cancer,13,15,70,84,"
More than 75% of the reported mutations in the hereditary breast and ovarian cancer gene, BRCA1, result in truncated proteins.",7663517_1,0,1955,0
1956,ovarian cancer,6,8,34,48,"In 45 patients from breast and/or ovarian cancer families we found six novel mutations  two single nucleotide insertions, three small deletions (1-5 bp) and a nonsense mutation identified two unrelated families.",7663517_3,0,1956,0
1970,atrophy,29,30,184,191,Quantification of CTG repeat size may allow an early estimate on the probability of brain involvement in DM; cognitive dysfunction is associated with white matter lesions and cerebral atrophy later on in the course..,7696601_9,0,1970,0
1978,breast cancer,14,16,82,95,Age at diagnosis as an indicator of eligibility for BRCA1 DNA testing in familial breast cancer.,7759075_0,0,1978,0
1979,breast cancer,7,9,46,59,"
We searched for criteria that could indicate breast cancer families with a high prior probability of being caused by the breast/ovarian cancer susceptibility locus BRCA1 on chromosome 17.",7759075_1,0,1979,0
1981,breast cancer,14,16,80,93,"To this end, we performed a linkage study with 59 consecutively collected Dutch breast cancer families, including 16 with at least one case of ovarian cancer.",7759075_2,0,1981,0
1983,ovarian cancer,14,16,86,100,We used an intake cut-off of at least three first-degree relatives with breast and/or ovarian cancer at any age.,7759075_3,0,1983,0
1984,breast cancer,10,12,61,74,Significant evidence for linkage was found only among the 13 breast cancer families with a mean age at diagnosis of less than 45 years.,7759075_4,0,1984,0
1985,cancer,7,8,53,59,"An unexpectedly low proportion of the breast-ovarian cancer families were estimated to be linked to BRCA1, which could be due to a founder effect in the Dutch population.",7759075_5,0,1985,0
1986,ovarian cancer,35,37,218,232,"Given the expected logistical problems in clinical management now that BRCA1 has been identified, we propose an interim period in which only families with a strong positive family history for early onset breast and/or ovarian cancer will be offered BRCA1 mutation testing..",7759075_6,0,1986,0
1987,cancer,8,9,58,64,Linkage analysis of 26 Canadian breast and breast-ovarian cancer families.,7759076_0,0,1987,0
1988,ovarian cancer,10,12,65,79,"
We have examined 26 Canadian families with hereditary breast or ovarian cancer for linkage to markers flanking the BRCA1 gene on chromosome 17q12-q21.",7759076_1,0,1988,0
1989,ovarian cancer,8,10,41,55,"Of the 15 families that contain cases of ovarian cancer, 94% were estimated to be linked to BRCA1.",7759076_2,0,1989,0
1990,breast cancer,17,19,87,100,"In contrast, there was no overall evidence of linkage in the group of 10 families with breast cancer without ovarian cancer.",7759076_3,0,1990,0
1991,ovarian cancer,20,22,109,123,"In contrast, there was no overall evidence of linkage in the group of 10 families with breast cancer without ovarian cancer.",7759076_3,0,1991,0
1993,cancer,27,28,161,167,"A genetic recombinant in a breast-ovarian cancer family indicates a placement of BRCA1 telomeric to D17S776, and helps to define the region of assignment of the cancer susceptibility gene.",7759076_4,0,1993,0
1994,cancers,1,2,6,13,"Other cancers of interest that appeared in the BRCA1-linked families included primary peritoneal cancer, cancer of the fallopian tube, and malignant melanoma..",7759076_5,0,1994,0
1995,cancer,13,14,97,103,"Other cancers of interest that appeared in the BRCA1-linked families included primary peritoneal cancer, cancer of the fallopian tube, and malignant melanoma..",7759076_5,0,1995,0
1996,cancer,15,16,105,111,"Other cancers of interest that appeared in the BRCA1-linked families included primary peritoneal cancer, cancer of the fallopian tube, and malignant melanoma..",7759076_5,0,1996,0
2020,cardiomyopathy,8,9,50,64,At least four of them presented with hypertrophic cardiomyopathy.,7769092_8,0,2020,0
2023,hemolysis,24,25,163,172,"The probands serum was incapable of mediating lysis of erythrocytes from a patient with paroxysmal nocturnal hemoglobinuria in both the sucrose hemolysia and acid hemolysis tests, and also lacked bactericidal activity against sensitized or unsensitized Salmonella typhi.",777027_10,0,2023,0
2037,ovarian cancer,19,21,128,142,"
The BRCA1 gene on chromosome 17q21 is responsible for an autosomal dominant syndrome of increased susceptibility to breast and ovarian cancer but no somatic mutations in tumours have yet been described.",7795652_1,0,2037,0
2040,cancers,28,29,158,165,Our data support a tumour suppressor mechanism for BRCA1; somatic mutations and LOH may result in inactivation of BRCA1 in at least a small number of ovarian cancers..,7795652_4,0,2040,0
2041,breast cancer,12,14,86,99,Decreased expression of BRCA1 accelerates growth and is often present during sporadic breast cancer progression.,7795653_0,0,2041,0
2042,ovarian cancer,9,11,61,75,"
We have characterized expression of the familial breast and ovarian cancer gene, BRCA1, in cases of non-hereditary (sporadic) breast cancer and analyzed the effect of antisense inhibition of BRCA1 on the proliferative rate of mammary epithelial cells.",7795653_1,0,2042,0
2043,breast cancer,22,24,127,140,"
We have characterized expression of the familial breast and ovarian cancer gene, BRCA1, in cases of non-hereditary (sporadic) breast cancer and analyzed the effect of antisense inhibition of BRCA1 on the proliferative rate of mammary epithelial cells.",7795653_1,0,2043,0
2045,cancer,15,16,98,104,BRCA1 mRNA levels are markedly decreased during the transition from carcinoma in situ to invasive cancer.,7795653_2,0,2045,0
2046,breast cancer,22,24,143,156,These studies suggest that BRCA1 may normally serve as a negative regulator of mammary epithelial cell growth whose function is compromised in breast cancer either by direct mutation or alterations in gene expression..,7795653_4,0,2046,0
2072,cancer,8,9,61,67,An evaluation of genetic heterogeneity in 145 breast-ovarian cancer families.,7825586_0,0,2072,0
2073,Breast Cancer,0,2,0,13,Breast Cancer Linkage Consortium.,7825586_1,0,2073,0
2075,cancer,9,10,73,79,"
The breast-ovary cancer-family syndrome is a dominant predisposition to cancer of the breast and ovaries which has been mapped to chromosome region 17q12-q21.",7825586_2,0,2075,0
2077,ovarian cancer,16,18,86,100,We report here the results of a linkage analysis of 145 families with both breast and ovarian cancer.,7825586_4,0,2077,0
2078,breast cancer,19,21,98,111,These families contain either a total of three or more cases of early-onset (before age 60 years) breast cancer or ovarian cancer.,7825586_5,0,2078,0
2080,ovarian cancer,8,10,44,58,All families contained at least one case of ovarian cancer.,7825586_6,0,2080,0
2081,breast cancer,9,11,43,56,"None of the 13 families with cases of male breast cancer appear to be linked, but it is estimated that 92% (95% confidence interval 76% -100%) of families with no male breast cancer and with two or more ovarian cancers are linked to BRCA1.",7825586_8,0,2081,0
2082,breast cancer,38,40,168,181,"None of the 13 families with cases of male breast cancer appear to be linked, but it is estimated that 92% (95% confidence interval 76% -100%) of families with no male breast cancer and with two or more ovarian cancers are linked to BRCA1.",7825586_8,0,2082,0
2083,cancers,46,47,211,218,"None of the 13 families with cases of male breast cancer appear to be linked, but it is estimated that 92% (95% confidence interval 76% -100%) of families with no male breast cancer and with two or more ovarian cancers are linked to BRCA1.",7825586_8,0,2083,0
2086,ovarian cancer,18,20,101,115,"However, the large majority of families with early-onset breast cancer and with two or more cases of ovarian cancer are likely to be due to BRCA1 mutations..",7825586_10,0,2086,0
2114,ovarian cancer,11,13,68,82,Mutations in the BRCA1 gene in families with early-onset breast and ovarian cancer.,7894491_0,0,2114,0
2115,ovarian cancer,11,13,64,78,"
We analysed 50 probands with a family history of breast and/or ovarian cancer for germline mutations in the coding region of the BRCA1 candidate gene, using single-strand conformation polymorphism (SSCP) analysis on PCR-amplified genomic DNA.",7894491_1,0,2115,0
2116,ovarian cancer,12,14,77,91,Confirmation of BRCA1 by analysis of germline mutations linked to breast and ovarian cancer in ten families.,7894493_0,0,2116,0
2118,ovarian cancer,26,28,172,186,"
We provide genetic evidence supporting the identity of the candidate gene for BRCA1 through the characterization of germline mutations in 63 breast cancer patients and 10 ovarian cancer patients in ten families with cancer linked to chromosome 17q21.",7894493_1,0,2118,0
2119,cancer,33,34,217,223,"
We provide genetic evidence supporting the identity of the candidate gene for BRCA1 through the characterization of germline mutations in 63 breast cancer patients and 10 ovarian cancer patients in ten families with cancer linked to chromosome 17q21.",7894493_1,0,2119,0
2120,ovarian cancer,7,9,39,53,The four families with both breast and ovarian cancer had chain termination mutations in the N-terminal half of the protein..,7894493_6,0,2120,0
2135,ovarian cancer,4,6,29,43,Genetic instability in human ovarian cancer cell lines.,7937795_0,0,2135,0
2137,tumor,25,26,142,147,"
We have analyzed the stability of microsatellites in cell lines derived from human ovarian cancers and found that 5 out of 10 of the ovarian tumor cell lines are genetically unstable at the majority of the loci analyzed.",7937795_1,0,2137,0
2140,tumors,7,8,48,54,We conclude that genomic instability in ovarian tumors is a dynamic and ongoing process whose high frequency may have been previously underestimated by PCR-based allelotyping of bulk tumor tissue.,7937795_3,0,2140,0
2141,tumor,27,28,183,188,We conclude that genomic instability in ovarian tumors is a dynamic and ongoing process whose high frequency may have been previously underestimated by PCR-based allelotyping of bulk tumor tissue.,7937795_3,0,2141,0
2142,tumor,12,13,72,77,"We have identified the source of the genetic instability in one ovarian tumor as a point mutation (R524P) in the human mismatch-repair gene MSH2 (Salmonella MutS homologue), which has recently been shown to be involved in hereditary nonpolyposis colorectal cancer.",7937795_4,0,2142,0
2145,tumor,6,7,40,45,"The genetic instability observed in the tumor and cell line DNA, together with the germ-line mutation in a mismatch-repair gene, suggest that the MSH2 gene is involved in the onset and/or progression in a subset of ovarian cancer..",7937795_7,0,2145,0
2146,ovarian cancer,38,40,215,229,"The genetic instability observed in the tumor and cell line DNA, together with the germ-line mutation in a mismatch-repair gene, suggest that the MSH2 gene is involved in the onset and/or progression in a subset of ovarian cancer..",7937795_7,0,2146,0
2147,tumors,6,7,43,49,"
Loss of heterozygosity data from familial tumors suggest that BRCA1, a gene that confers susceptibility to ovarian and early-onset breast cancer, encodes a tumor suppressor.",7939630_1,0,2147,0
2148,breast cancer,20,22,132,145,"
Loss of heterozygosity data from familial tumors suggest that BRCA1, a gene that confers susceptibility to ovarian and early-onset breast cancer, encodes a tumor suppressor.",7939630_1,0,2148,0
2150,cancers,14,15,80,87,"The BRCA1 region is also subject to allelic loss in sporadic breast and ovarian cancers, an indication that BRCA1 mutations may occur somatically in these tumors.",7939630_2,0,2150,0
2152,tumors,13,14,81,87,The BRCA1 coding region was examined for mutations in primary breast and ovarian tumors that show allele loss at the BRCA1 locus.,7939630_3,0,2152,0
2153,cancers,25,26,147,154,Mutations were detected in 3 of 32 breast and 1 of 12 ovarian carcinomas; all four mutations were germline alterations and occurred in early-onset cancers.,7939630_4,0,2153,0
2154,cancers,21,22,122,129,These results suggest that mutation of BRCA1 may not be critical in the development of the majority of breast and ovarian cancers that arise in the absence of a mutant germline allele..,7939630_5,0,2154,0
2155,cataracts,9,10,52,61,"PAX6 gene dosage effect in a family with congenital cataracts, aniridia, anophthalmia and central nervous system defects.",7951315_0,0,2155,0
2160,cataracts,23,24,145,154,"To study this dosage effect, we characterized two PAX6 mutations in a family segregating aniridia and a milder syndrome consisting of congenital cataracts and late onset corneal dystrophy.",7951315_2,0,2160,0
2162,cancer,23,24,124,130,"
We have constructed a physical map of a 4 cM region on chromosome 17q12-21 that contains the hereditary breast and ovarian cancer gene BRCA1.",7951316_1,0,2162,0
2212,carcinoma,4,5,31,40,Adenomatous polyposis coli and carcinoma of the rectum were subsequently diagnosed in the patient.,8071957_3,0,2212,0
2213,breast cancer,2,4,14,27,Familial male breast cancer is not linked to the BRCA1 locus on chromosome 17q.,8075631_0,0,2213,0
2214,Breast cancer,0,2,1,14,"
Breast cancer in men is about a hundredfold less common than in women and this has hindered research into its genetic basis.",8075631_1,0,2214,0
2215,breast cancer,12,14,60,73,"We have examined 22 families with at least one case of male breast cancer for linkage to the hereditary breast and ovarian cancer locus, BRCA1, on chromosome 17q.",8075631_2,0,2215,0
